tweet_id,date_x,text,source_x,rating_numerator,rating_denominator,name,date_y,full_text,source_y,retweet_count,favorite_count,favorited,retweeted,image_url,img_num,prediction_image,prediction1_confidence,prediction1_dog,prediction2_image,prediction2_confidence,prediction2_dog,Prediction3_image,prediction3_confidence,prediction3_dog,stages,dog_stage_values,rating_number,rating
793271401113350145,2016-11-01,Meet Dave. It's his favorite day of the year. He gets to fulfill his dream of being a dinosaur. 12/10 inspirational af https://t.co/MgQSdfZGPN,"""http://twitter.com/download/iphone"" rel=""nofollow"">Twitter for iPhone</a>",12.0,10.0,Dave,2016-11-01,Meet Dave. It's his favorite day of the year. He gets to fulfill his dream of being a dinosaur. 12/10 inspirational af https://t.co/MgQSdfZGPN,"""http://twitter.com/download/iphone"" rel=""nofollow"">Twitter for iPhone</a>",2763.0,9677.0,False,False,https://pbs.twimg.com/media/CwJEIKTWYAAvL-T.jpg,1,Siberian_husky,0.2316949999999999,True,Eskimo_dog,0.206749,True,Pembroke,0.0701195,True,floofer,None,1.2,12.0/10.0
793210959003287553,2016-10-31,This is Maude. She's the h*ckin happiest wasp you've ever seen. 10/10 would pet with caution https://t.co/etL8FHBrh8,"""http://twitter.com/download/iphone"" rel=""nofollow"">Twitter for iPhone</a>",10.0,10.0,Maude,2016-10-31,This is Maude. She's the h*ckin happiest wasp you've ever seen. 10/10 would pet with caution https://t.co/etL8FHBrh8,"""http://twitter.com/download/iphone"" rel=""nofollow"">Twitter for iPhone</a>",3301.0,9997.0,False,False,https://pbs.twimg.com/media/CwINKJeW8AYHVkn.jpg,1,doormat,0.874431,False,French_bulldog,0.0187590999999999,True,Boston_bull,0.0151344,True,floofer,None,1.0,10.0/10.0
786233965241827333,2016-10-12,This is Mattie. She's extremely dangerous. Will bite your h*ckin finger right off. Still 11/10 would pet with caution https://t.co/78c9W8kLFh,"""http://twitter.com/download/iphone"" rel=""nofollow"">Twitter for iPhone</a>",11.0,10.0,Mattie,2016-10-12,This is Mattie. She's extremely dangerous. Will bite your h*ckin finger right off. Still 11/10 would pet with caution https://t.co/78c9W8kLFh,"""http://twitter.com/download/iphone"" rel=""nofollow"">Twitter for iPhone</a>",5571.0,17178.0,False,False,https://pbs.twimg.com/media/CulDnZpWcAAGbZ-.jpg,1,Labrador_retriever,0.478193,True,schipperke,0.224817,True,Staffordshire_bullterrier,0.0773956,True,floofer,None,1.1,11.0/10.0
793180763617361921,2016-10-31,This is Newt. He's a strawberry. 11/10 https://t.co/2VhmlwxA1Q,"""http://twitter.com/download/iphone"" rel=""nofollow"">Twitter for iPhone</a>",11.0,10.0,Newt,2016-10-31,This is Newt. He's a strawberry. 11/10 https://t.co/2VhmlwxA1Q,"""http://twitter.com/download/iphone"" rel=""nofollow"">Twitter for iPhone</a>",2310.0,7740.0,False,False,https://pbs.twimg.com/media/CwHxsdYVMAAqGCJ.jpg,1,Lakeland_terrier,0.266824,True,Irish_terrier,0.218783,True,Airedale,0.13296,True,floofer,None,1.1,11.0/10.0
793120401413079041,2016-10-31,"This is Robin. She's desperately trying to do me a frighten, but her tongue drastically decreases her spook value. Still 11/10 great effort https://t.co/sxMrsOZ8zb","""http://twitter.com/download/iphone"" rel=""nofollow"">Twitter for iPhone</a>",11.0,10.0,Robin,2016-10-31,"This is Robin. She's desperately trying to do me a frighten, but her tongue drastically decreases her spook value. Still 11/10 great effort https://t.co/sxMrsOZ8zb","""http://twitter.com/download/iphone"" rel=""nofollow"">Twitter for iPhone</a>",4551.0,14202.0,False,False,https://pbs.twimg.com/media/CwG6zDfWcAA8jBD.jpg,1,Labrador_retriever,0.7249439999999999,True,golden_retriever,0.169744,True,kuvasz,0.0355023,True,floofer,None,1.1,11.0/10.0
792883833364439040,2016-10-31,This is Bailey. She's rather h*ckin hype for Halloween tomorrow. Carved those pupkins herself. 12/10 https://t.co/v17mFm0Ftz,"""http://twitter.com/download/iphone"" rel=""nofollow"">Twitter for iPhone</a>",12.0,10.0,Bailey,2016-10-31,This is Bailey. She's rather h*ckin hype for Halloween tomorrow. Carved those pupkins herself. 12/10 https://t.co/v17mFm0Ftz,"""http://twitter.com/download/iphone"" rel=""nofollow"">Twitter for iPhone</a>",4964.0,12666.0,False,False,https://pbs.twimg.com/media/CwDjoH3WAAIniIs.jpg,3,jack-o'-lantern,0.999306,False,basketball,0.000113129,False,standard_poodle,8.31451e-05,True,floofer,None,1.2,12.0/10.0
792394556390137856,2016-10-29,Meet BeBe. She rocks the messy bun of your dreams. H*ckin flawless. 12/10 would watch her tutorial https://t.co/of0pFNBIl8,"""http://twitter.com/download/iphone"" rel=""nofollow"">Twitter for iPhone</a>",12.0,10.0,BeBe,2016-10-29,Meet BeBe. She rocks the messy bun of your dreams. H*ckin flawless. 12/10 would watch her tutorial https://t.co/of0pFNBIl8,"""http://twitter.com/download/iphone"" rel=""nofollow"">Twitter for iPhone</a>",4998.0,15128.0,False,False,https://pbs.twimg.com/media/Cv8moW9W8AIHOxR.jpg,2,cocker_spaniel,0.746387,True,Irish_setter,0.0916151,True,miniature_poodle,0.0610781999999999,True,floofer,None,1.2,12.0/10.0
791312159183634433,2016-10-26,This is Mabel. She's super h*ckin smol. Portable af. Comes with the smol shoe. 12/10 would keep in frocket https://t.co/GGJvxYt3xK,"""http://twitter.com/download/iphone"" rel=""nofollow"">Twitter for iPhone</a>",12.0,10.0,Mabel,2016-10-26,This is Mabel. She's super h*ckin smol. Portable af. Comes with the smol shoe. 12/10 would keep in frocket https://t.co/GGJvxYt3xK,"""http://twitter.com/download/iphone"" rel=""nofollow"">Twitter for iPhone</a>",2963.0,9841.0,False,False,https://pbs.twimg.com/media/CvtONV4WAAAQ3Rn.jpg,4,miniature_pinscher,0.892925,True,toy_terrier,0.0955238,True,Doberman,0.00354426,True,floofer,None,1.2,12.0/10.0
790987426131050500,2016-10-25,This is Misty. She has a cowboy hat on her nose. 12/10 https://t.co/Eno0mypHIr,"""http://twitter.com/download/iphone"" rel=""nofollow"">Twitter for iPhone</a>",12.0,10.0,Misty,2016-10-25,This is Misty. She has a cowboy hat on her nose. 12/10 https://t.co/Eno0mypHIr,"""http://twitter.com/download/iphone"" rel=""nofollow"">Twitter for iPhone</a>",2483.0,11089.0,False,False,https://pbs.twimg.com/media/Cvom3ZJXEAE29TD.jpg,1,cocker_spaniel,0.349195,True,flat-coated_retriever,0.309535,True,Newfoundland,0.104768,True,floofer,None,1.2,12.0/10.0
790581949425475584,2016-10-24,This is Duke. He sneaks into the fridge sometimes. It's his safe place. 11/10 would give little jacket if necessary https://t.co/Fd5WFDTMH4,"""http://twitter.com/download/iphone"" rel=""nofollow"">Twitter for iPhone</a>",11.0,10.0,Duke,2016-10-24,This is Duke. He sneaks into the fridge sometimes. It's his safe place. 11/10 would give little jacket if necessary https://t.co/Fd5WFDTMH4,"""http://twitter.com/download/iphone"" rel=""nofollow"">Twitter for iPhone</a>",8183.0,22473.0,False,False,https://pbs.twimg.com/media/Cvi2FiKWgAAif1u.jpg,2,refrigerator,0.998886,False,malinois,0.000152999,True,kelpie,0.000130817,True,floofer,None,1.1,11.0/10.0
790277117346975746,2016-10-23,This is Bruce. He never backs down from a challenge. 11/10 you got this Bruce https://t.co/aI7umZHIq7,"""http://twitter.com/download/iphone"" rel=""nofollow"">Twitter for iPhone</a>",11.0,10.0,Bruce,2016-10-23,This is Bruce. He never backs down from a challenge. 11/10 you got this Bruce https://t.co/aI7umZHIq7,"""http://twitter.com/download/iphone"" rel=""nofollow"">Twitter for iPhone</a>",3732.0,14081.0,False,False,https://pbs.twimg.com/media/Cveg1-NXgAASaaT.jpg,1,Labrador_retriever,0.427742,True,Great_Dane,0.190503,True,curly-coated_retriever,0.146427,True,floofer,None,1.1,11.0/10.0
789986466051088384,2016-10-23,This is Happy. He's a bathtub reviewer. Seems to be pleased with this one. 12/10 https://t.co/Ln89R4FP7v,"""http://twitter.com/download/iphone"" rel=""nofollow"">Twitter for iPhone</a>",12.0,10.0,Happy,2016-10-23,This is Happy. He's a bathtub reviewer. Seems to be pleased with this one. 12/10 https://t.co/Ln89R4FP7v,"""http://twitter.com/download/iphone"" rel=""nofollow"">Twitter for iPhone</a>",2704.0,10369.0,False,False,https://pbs.twimg.com/media/CvaYgDOWgAEfjls.jpg,1,tub,0.479477,False,bathtub,0.325106,False,golden_retriever,0.0785304999999999,True,floofer,None,1.2,12.0/10.0
789599242079838210,2016-10-21,This is Brownie. She's wearing a Halloween themed onesie. 12/10 festive af https://t.co/0R4meWXFOx,"""http://twitter.com/download/iphone"" rel=""nofollow"">Twitter for iPhone</a>",12.0,10.0,Brownie,2016-10-21,This is Brownie. She's wearing a Halloween themed onesie. 12/10 festive af https://t.co/0R4meWXFOx,"""http://twitter.com/download/iphone"" rel=""nofollow"">Twitter for iPhone</a>",2279.0,7620.0,False,False,https://pbs.twimg.com/media/CvU4UZpXgAE1pAV.jpg,2,Chesapeake_Bay_retriever,0.8788219999999999,True,beagle,0.0185703,True,Labrador_retriever,0.0174985,True,floofer,None,1.2,12.0/10.0
789268448748703744,2016-10-21,This is Stella. She's happier than I will ever be. 10/10 would trade lives with https://t.co/JSs2bfDtTS,"""http://twitter.com/download/iphone"" rel=""nofollow"">Twitter for iPhone</a>",10.0,10.0,Stella,2016-10-21,This is Stella. She's happier than I will ever be. 10/10 would trade lives with https://t.co/JSs2bfDtTS,"""http://twitter.com/download/iphone"" rel=""nofollow"">Twitter for iPhone</a>",3014.0,10196.0,False,False,https://pbs.twimg.com/media/CvQLdotWcAAZn86.jpg,1,malamute,0.81286,True,Siberian_husky,0.120853,True,Eskimo_dog,0.0242692999999999,True,floofer,None,1.0,10.0/10.0
788908386943430656,2016-10-20,"This is Lucy. She destroyed not one, but two remotes trying to turn off the debate. 11/10 relatable af https://t.co/3BXh073tDm","""http://twitter.com/download/iphone"" rel=""nofollow"">Twitter for iPhone</a>",11.0,10.0,Lucy,2016-10-20,"This is Lucy. She destroyed not one, but two remotes trying to turn off the debate. 11/10 relatable af https://t.co/3BXh073tDm","""http://twitter.com/download/iphone"" rel=""nofollow"">Twitter for iPhone</a>",14409.0,30653.0,False,False,https://pbs.twimg.com/media/CvLD-mbWYAAFI8w.jpg,1,remote_control,0.8815379999999999,False,oscilloscope,0.0355131,False,golden_retriever,0.0340897,True,floofer,None,1.1,11.0/10.0
787810552592695296,2016-10-17,This is Frank. He wears sunglasses and walks himself. 11/10 I'll never be this cool or independent https://t.co/pNNjBtHWPc,"""http://twitter.com/download/iphone"" rel=""nofollow"">Twitter for iPhone</a>",11.0,10.0,Frank,2016-10-17,This is Frank. He wears sunglasses and walks himself. 11/10 I'll never be this cool or independent https://t.co/pNNjBtHWPc,"""http://twitter.com/download/iphone"" rel=""nofollow"">Twitter for iPhone</a>",3540.0,9717.0,False,False,https://pbs.twimg.com/media/Cu7dg2RXYAIaGXE.jpg,2,pug,0.362835,True,French_bulldog,0.2218639999999999,True,English_setter,0.0804183,True,floofer,None,1.1,11.0/10.0
793150605191548928,2016-10-31,This is Nida. She's a free elf. Waited so long for this day. 11/10 https://t.co/3lE8Izgmkf,"""http://twitter.com/download/iphone"" rel=""nofollow"">Twitter for iPhone</a>",11.0,10.0,Nida,2016-10-31,This is Nida. She's a free elf. Waited so long for this day. 11/10 https://t.co/3lE8Izgmkf,"""http://twitter.com/download/iphone"" rel=""nofollow"">Twitter for iPhone</a>",1984.0,6909.0,False,False,https://pbs.twimg.com/media/CwHWOZ7W8AAHv8S.jpg,1,Italian_greyhound,0.193869,True,bluetick,0.16038,True,standard_poodle,0.1259819999999999,True,floofer,None,1.1,11.0/10.0
709207347839836162,2016-03-14,This is Penny. She's trying on her prom dress. Stunning af 11/10 https://t.co/qcZDZGCapg,"""http://twitter.com/download/iphone"" rel=""nofollow"">Twitter for iPhone</a>",11.0,10.0,Penny,2016-03-14,This is Penny. She's trying on her prom dress. Stunning af 11/10 https://t.co/qcZDZGCapg,"""http://twitter.com/download/iphone"" rel=""nofollow"">Twitter for iPhone</a>",6567.0,13755.0,False,False,https://pbs.twimg.com/media/CdecUSzUIAAHCvg.jpg,1,Chihuahua,0.948323,True,Italian_greyhound,0.0177303,True,quilt,0.0166879,False,floofer,None,1.1,11.0/10.0
716285507865542656,2016-04-02,This is Stephanus. She stays woke. 12/10 https://t.co/WIWabMngQZ,"""http://twitter.com/download/iphone"" rel=""nofollow"">Twitter for iPhone</a>",12.0,10.0,Stephanus,2016-04-02,This is Stephanus. She stays woke. 12/10 https://t.co/WIWabMngQZ,"""http://twitter.com/download/iphone"" rel=""nofollow"">Twitter for iPhone</a>",1225.0,3041.0,False,False,https://pbs.twimg.com/media/CfDB3aJXEAAEZNv.jpg,1,Yorkshire_terrier,0.4304199999999999,True,silky_terrier,0.196769,True,cairn,0.0726761,True,floofer,None,1.2,12.0/10.0
681297372102656000,2015-12-28,"This is actually a lion. We only rate dogs. For the last time please only send dogs. Thank u.
12/10 would still pet https://t.co/Pp26dMQxap","""http://twitter.com/download/iphone"" rel=""nofollow"">Twitter for iPhone</a>",12.0,10.0,actually,2015-12-28,"This is actually a lion. We only rate dogs. For the last time please only send dogs. Thank u.
12/10 would still pet https://t.co/Pp26dMQxap","""http://twitter.com/download/iphone"" rel=""nofollow"">Twitter for iPhone</a>",1091.0,3490.0,False,False,https://pbs.twimg.com/media/CXR0WJ_W8AMd_O8.jpg,1,Lhasa,0.482401,True,Shih-Tzu,0.113672,True,Pomeranian,0.0962286,True,floofer,None,1.2,12.0/10.0
676430933382295552,2015-12-14,"Meet Duke. He's an Urban Parmesan. They know he's scared of the green rubber dog. ""Why u do dis?"" thinks Duke. 10/10 https://t.co/3bim9U5Idr","""http://twitter.com/download/iphone"" rel=""nofollow"">Twitter for iPhone</a>",10.0,10.0,Duke,2015-12-14,"Meet Duke. He's an Urban Parmesan. They know he's scared of the green rubber dog. ""Why u do dis?"" thinks Duke. 10/10 https://t.co/3bim9U5Idr","""http://twitter.com/download/iphone"" rel=""nofollow"">Twitter for iPhone</a>",385.0,1526.0,False,False,https://pbs.twimg.com/media/CWMqV7WUYAEEClG.jpg,1,golden_retriever,0.583875,True,cocker_spaniel,0.203671,True,Labrador_retriever,0.0361217,True,floofer,None,1.0,10.0/10.0
676146341966438401,2015-12-13,This is Bert. He likes flowers. 10/10 https://t.co/lmQRrNxaQu,"""http://twitter.com/download/iphone"" rel=""nofollow"">Twitter for iPhone</a>",10.0,10.0,Bert,2015-12-13,This is Bert. He likes flowers. 10/10 https://t.co/lmQRrNxaQu,"""http://twitter.com/download/iphone"" rel=""nofollow"">Twitter for iPhone</a>",744.0,2077.0,False,False,https://pbs.twimg.com/media/CWIngp5WEAAJOy3.jpg,1,Irish_water_spaniel,0.388332,True,standard_poodle,0.284121,True,greenhouse,0.0348681,False,floofer,None,1.0,10.0/10.0
676101918813499392,2015-12-13,Meet Striker. He's ready for Christmas. 11/10 https://t.co/B3xxSLjQSH,"""http://twitter.com/download/iphone"" rel=""nofollow"">Twitter for iPhone</a>",11.0,10.0,Striker,2015-12-13,Meet Striker. He's ready for Christmas. 11/10 https://t.co/B3xxSLjQSH,"""http://twitter.com/download/iphone"" rel=""nofollow"">Twitter for iPhone</a>",1284.0,3042.0,False,False,https://pbs.twimg.com/media/CWH_FTgWIAAwOUy.jpg,1,Shih-Tzu,0.225848,True,Norfolk_terrier,0.186873,True,Irish_terrier,0.1069869999999999,True,floofer,None,1.1,11.0/10.0
675781562965868544,2015-12-12,Say hello to Buddah. He was Waldo for Halloween. 11/10 https://t.co/DVAqAnb624,"""http://twitter.com/download/iphone"" rel=""nofollow"">Twitter for iPhone</a>",11.0,10.0,Buddah,2015-12-12,Say hello to Buddah. He was Waldo for Halloween. 11/10 https://t.co/DVAqAnb624,"""http://twitter.com/download/iphone"" rel=""nofollow"">Twitter for iPhone</a>",537.0,1750.0,False,False,https://pbs.twimg.com/media/CWDbv2yU4AARfeH.jpg,1,Maltese_dog,0.921968,True,West_Highland_white_terrier,0.0178107,True,toy_poodle,0.0135554,True,floofer,None,1.1,11.0/10.0
675710890956750848,2015-12-12,This is Lenny. He was just told that he couldn't explore the fish tank. 12/10 smh all that work for nothing https://t.co/JWi6YrpiO1,"""http://twitter.com/download/iphone"" rel=""nofollow"">Twitter for iPhone</a>",12.0,10.0,Lenny,2015-12-12,This is Lenny. He was just told that he couldn't explore the fish tank. 12/10 smh all that work for nothing https://t.co/JWi6YrpiO1,"""http://twitter.com/download/iphone"" rel=""nofollow"">Twitter for iPhone</a>",928.0,2046.0,False,False,https://pbs.twimg.com/media/CWCbd8ZWoAAtqoH.jpg,2,standard_schnauzer,0.441427,True,miniature_schnauzer,0.248885,True,Sealyham_terrier,0.164967,True,floofer,None,1.2,12.0/10.0
675706639471788032,2015-12-12,This is a Sizzlin Menorah spaniel from Brooklyn named Wylie. Lovable eyes. Chiller as hell. 10/10 and I'm out.. poof https://t.co/7E0AiJXPmI,"""http://twitter.com/download/iphone"" rel=""nofollow"">Twitter for iPhone</a>",10.0,10.0,a,2015-12-12,This is a Sizzlin Menorah spaniel from Brooklyn named Wylie. Lovable eyes. Chiller as hell. 10/10 and I'm out.. poof https://t.co/7E0AiJXPmI,"""http://twitter.com/download/iphone"" rel=""nofollow"">Twitter for iPhone</a>",106.0,693.0,False,False,https://pbs.twimg.com/media/CWCXj35VEAIFvtk.jpg,1,English_springer,0.9903,True,Welsh_springer_spaniel,0.00207991,True,cocker_spaniel,0.00201378,True,floofer,None,1.0,10.0/10.0
675531475945709568,2015-12-12,This is Ellie AKA Queen Slayer of the Orbs. Very self-motivated. Great yard. Rad foliage. 10/10 would pet diligently https://t.co/c9jmg3Xtzn,"""http://twitter.com/download/iphone"" rel=""nofollow"">Twitter for iPhone</a>",10.0,10.0,Ellie,2015-12-12,This is Ellie AKA Queen Slayer of the Orbs. Very self-motivated. Great yard. Rad foliage. 10/10 would pet diligently https://t.co/c9jmg3Xtzn,"""http://twitter.com/download/iphone"" rel=""nofollow"">Twitter for iPhone</a>",428.0,1276.0,False,False,https://pbs.twimg.com/media/CV_4ShmUYAA3wNu.jpg,1,Pembroke,0.918441,True,Cardigan,0.0273395,True,Siberian_husky,0.020221,True,floofer,None,1.0,10.0/10.0
675497103322386432,2015-12-12,Meet Reggie. He's going for the world record. Must concentrate. Focus up pup. 11/10 we all believe in you Reggie https://t.co/h3AWz4AzuC,"""http://twitter.com/download/iphone"" rel=""nofollow"">Twitter for iPhone</a>",11.0,10.0,Reggie,2015-12-12,Meet Reggie. He's going for the world record. Must concentrate. Focus up pup. 11/10 we all believe in you Reggie https://t.co/h3AWz4AzuC,"""http://twitter.com/download/iphone"" rel=""nofollow"">Twitter for iPhone</a>",1443.0,3397.0,False,False,https://pbs.twimg.com/media/CV_ZAhcUkAUeKtZ.jpg,1,vizsla,0.5195890000000001,True,miniature_pinscher,0.0647712,True,Rhodesian_ridgeback,0.0614913,True,floofer,None,1.1,11.0/10.0
675015141583413248,2015-12-10,Meet Moe. He's a golden Fetty Woof. Doesn't respect the authorities. Might own a motorhome? 10/10 revolutionary pup https://t.co/JAncIdNp8G,"""http://twitter.com/download/iphone"" rel=""nofollow"">Twitter for iPhone</a>",10.0,10.0,Moe,2015-12-10,Meet Moe. He's a golden Fetty Woof. Doesn't respect the authorities. Might own a motorhome? 10/10 revolutionary pup https://t.co/JAncIdNp8G,"""http://twitter.com/download/iphone"" rel=""nofollow"">Twitter for iPhone</a>",1335.0,2918.0,False,False,https://pbs.twimg.com/media/CV4iqh5WcAEV1E6.jpg,1,street_sign,0.290091,False,golden_retriever,0.258372,True,sandbar,0.132173,False,floofer,None,1.0,10.0/10.0
675003128568291329,2015-12-10,Meet Laela. She's adorable. Magnificent eyes. But I don't see a seat belt. Insubordinate.. and churlish. Still 12/10 https://t.co/pCGDgLkLo6,"""http://twitter.com/download/iphone"" rel=""nofollow"">Twitter for iPhone</a>",12.0,10.0,Laela,2015-12-10,Meet Laela. She's adorable. Magnificent eyes. But I don't see a seat belt. Insubordinate.. and churlish. Still 12/10 https://t.co/pCGDgLkLo6,"""http://twitter.com/download/iphone"" rel=""nofollow"">Twitter for iPhone</a>",517.0,1672.0,False,False,https://pbs.twimg.com/media/CV4XwYiWoAAHQIF.jpg,1,Pembroke,0.655279,True,Pomeranian,0.104164,True,Cardigan,0.0528177,True,floofer,None,1.2,12.0/10.0
674422304705744896,2015-12-09,This is Ava. She doesn't understand flowers. 12/10 would caress firmly https://t.co/BxTJAFSIgk,"""http://twitter.com/download/iphone"" rel=""nofollow"">Twitter for iPhone</a>",12.0,10.0,Ava,2015-12-09,This is Ava. She doesn't understand flowers. 12/10 would caress firmly https://t.co/BxTJAFSIgk,"""http://twitter.com/download/iphone"" rel=""nofollow"">Twitter for iPhone</a>",592.0,1536.0,False,False,https://pbs.twimg.com/media/CVwHgblWcAACWOD.jpg,1,golden_retriever,0.964497,True,Labrador_retriever,0.00900618,True,tennis_ball,0.00713883,False,floofer,None,1.2,12.0/10.0
674410619106390016,2015-12-09,This is Lenny. He wants to be a sprinkler. 10/10 you got this Lenny https://t.co/CZ0YaB40Hn,"""http://twitter.com/download/iphone"" rel=""nofollow"">Twitter for iPhone</a>",10.0,10.0,Lenny,2015-12-09,This is Lenny. He wants to be a sprinkler. 10/10 you got this Lenny https://t.co/CZ0YaB40Hn,"""http://twitter.com/download/iphone"" rel=""nofollow"">Twitter for iPhone</a>",515.0,1289.0,False,False,https://pbs.twimg.com/media/CVv84VDUEAEm3dW.jpg,1,brown_bear,0.698207,False,sea_lion,0.0464745,False,beagle,0.0194268,True,floofer,None,1.0,10.0/10.0
674372068062928900,2015-12-08,Meet Chesney. On the outside he stays calm &amp; collected. On the inside he's having a complete mental breakdown. 10/10 https://t.co/G4m0TFY9uc,"""http://twitter.com/download/iphone"" rel=""nofollow"">Twitter for iPhone</a>",10.0,10.0,Chesney,2015-12-08,Meet Chesney. On the outside he stays calm &amp; collected. On the inside he's having a complete mental breakdown. 10/10 https://t.co/G4m0TFY9uc,"""http://twitter.com/download/iphone"" rel=""nofollow"">Twitter for iPhone</a>",346.0,931.0,False,False,https://pbs.twimg.com/media/CVvZ0KTWwAAdXKV.jpg,1,seashore,0.346126,False,American_alligator,0.106404,False,sandbar,0.0493491,False,floofer,None,1.0,10.0/10.0
674291837063053312,2015-12-08,This is Kenny. He just wants to be included in the happenings. 11/10 https://t.co/2S6oye3XqK,"""http://twitter.com/download/iphone"" rel=""nofollow"">Twitter for iPhone</a>",11.0,10.0,Kenny,2015-12-08,This is Kenny. He just wants to be included in the happenings. 11/10 https://t.co/2S6oye3XqK,"""http://twitter.com/download/iphone"" rel=""nofollow"">Twitter for iPhone</a>",6533.0,15817.0,False,False,https://pbs.twimg.com/media/CVuQ2LeUsAAIe3s.jpg,1,Cardigan,0.611525,True,Pembroke,0.368566,True,Chihuahua,0.00332957,True,floofer,None,1.1,11.0/10.0
674082852460433408,2015-12-08,This is a Sagitariot Baklava mix. Loves her new hat. 11/10 radiant pup https://t.co/Bko5kFJYUU,"""http://twitter.com/download/iphone"" rel=""nofollow"">Twitter for iPhone</a>",11.0,10.0,a,2015-12-08,This is a Sagitariot Baklava mix. Loves her new hat. 11/10 radiant pup https://t.co/Bko5kFJYUU,"""http://twitter.com/download/iphone"" rel=""nofollow"">Twitter for iPhone</a>",186.0,804.0,False,False,https://pbs.twimg.com/media/CVrSxy7WsAAFD2F.jpg,1,Pomeranian,0.666957,True,Shetland_sheepdog,0.0280194,True,ski_mask,0.0206827,False,floofer,None,1.1,11.0/10.0
674051556661161984,2015-12-08,This is Lucy. She knits. Specializes in toboggans. 10/10 I'd buy a toboggan from Lucy https://t.co/YE2XDHy4Yk,"""http://twitter.com/download/iphone"" rel=""nofollow"">Twitter for iPhone</a>",10.0,10.0,Lucy,2015-12-08,This is Lucy. She knits. Specializes in toboggans. 10/10 I'd buy a toboggan from Lucy https://t.co/YE2XDHy4Yk,"""http://twitter.com/download/iphone"" rel=""nofollow"">Twitter for iPhone</a>",530.0,1564.0,False,False,https://pbs.twimg.com/media/CVq2UHwWEAAduMw.jpg,1,Shih-Tzu,0.179777,True,badger,0.16058,False,three-toed_sloth,0.132154,False,floofer,None,1.0,10.0/10.0
674019345211760640,2015-12-08,This is Acro. You briefly see her out of the corner of your eye. You look and she's not there. 10/10 mysterious pup https://t.co/fqiEsTduEs,"""http://twitter.com/download/iphone"" rel=""nofollow"">Twitter for iPhone</a>",10.0,10.0,Acro,2015-12-08,This is Acro. You briefly see her out of the corner of your eye. You look and she's not there. 10/10 mysterious pup https://t.co/fqiEsTduEs,"""http://twitter.com/download/iphone"" rel=""nofollow"">Twitter for iPhone</a>",340.0,1208.0,False,False,https://pbs.twimg.com/media/CVqZBO8WUAAd931.jpg,1,collie,0.992732,True,borzoi,0.0050428999999999,True,Shetland_sheepdog,0.00172478,True,floofer,None,1.0,10.0/10.0
673686845050527744,2015-12-07,This is George. He's upset that the 4th of July isn't everyday. 11/10 https://t.co/wImU0jdx3E,"""http://twitter.com/download/iphone"" rel=""nofollow"">Twitter for iPhone</a>",11.0,10.0,George,2015-12-07,This is George. He's upset that the 4th of July isn't everyday. 11/10 https://t.co/wImU0jdx3E,"""http://twitter.com/download/iphone"" rel=""nofollow"">Twitter for iPhone</a>",479.0,1544.0,False,False,https://pbs.twimg.com/media/CVlqi_AXIAASlcD.jpg,1,Pekinese,0.1859029999999999,True,guinea_pig,0.172951,False,pug,0.166183,True,floofer,None,1.1,11.0/10.0
673662677122719744,2015-12-07,This is Kendall. 12/10 would cuddle the hell out of https://t.co/fJulMurnfj,"""http://twitter.com/download/iphone"" rel=""nofollow"">Twitter for iPhone</a>",12.0,10.0,Kendall,2015-12-07,This is Kendall. 12/10 would cuddle the hell out of https://t.co/fJulMurnfj,"""http://twitter.com/download/iphone"" rel=""nofollow"">Twitter for iPhone</a>",397.0,1339.0,False,False,https://pbs.twimg.com/media/CVlUfBbUwAQyfcD.jpg,1,Labrador_retriever,0.95767,True,beagle,0.0124127,True,golden_retriever,0.00568913,True,floofer,None,1.2,12.0/10.0
673636718965334016,2015-12-06,This is a Lofted Aphrodisiac Terrier named Kip. Big fan of bed n breakfasts. Fits perfectly. 10/10 would pet firmly https://t.co/gKlLpNzIl3,"""http://twitter.com/download/iphone"" rel=""nofollow"">Twitter for iPhone</a>",10.0,10.0,a,2015-12-06,This is a Lofted Aphrodisiac Terrier named Kip. Big fan of bed n breakfasts. Fits perfectly. 10/10 would pet firmly https://t.co/gKlLpNzIl3,"""http://twitter.com/download/iphone"" rel=""nofollow"">Twitter for iPhone</a>",404.0,1194.0,False,False,https://pbs.twimg.com/media/CVk9ApFWUAA-S1s.jpg,1,wombat,0.880257,False,corn,0.0194207,False,pug,0.0190442999999999,True,floofer,None,1.0,10.0/10.0
