tweet_id,date_x,text,source_x,rating_numerator,rating_denominator,name,date_y,full_text,source_y,retweet_count,favorite_count,favorited,retweeted,image_url,img_num,prediction_image,prediction1_confidence,prediction1_dog,prediction2_image,prediction2_confidence,prediction2_dog,Prediction3_image,prediction3_confidence,prediction3_dog,stages,dog_stage_values,rating_number,rating
671166507850801152,2015-11-30,This is Herm. It's his first day of potty training. He's doing great. You got this Herm. 10/10 stellar pup https://t.co/gFl60yFJ0w,"""http://twitter.com/download/iphone"" rel=""nofollow"">Twitter for iPhone</a>",10.0,10.0,Herm,2015-11-30,This is Herm. It's his first day of potty training. He's doing great. You got this Herm. 10/10 stellar pup https://t.co/gFl60yFJ0w,"""http://twitter.com/download/iphone"" rel=""nofollow"">Twitter for iPhone</a>",390.0,931.0,False,False,https://pbs.twimg.com/media/CVB2TnWUYAA2pAU.jpg,1,refrigerator,0.829772,False,toilet_seat,0.0300832999999999,False,shower_curtain,0.0154606999999999,False,floofer,None,1.0,10.0/10.0
670840546554966016,2015-11-29,Meet Colby. He's that one cool friend that gets you into every party. Great hat. Sneaky tongue slip. 10/10 good pup https://t.co/jBnz3MjTzX,"""http://twitter.com/download/iphone"" rel=""nofollow"">Twitter for iPhone</a>",10.0,10.0,Colby,2015-11-29,Meet Colby. He's that one cool friend that gets you into every party. Great hat. Sneaky tongue slip. 10/10 good pup https://t.co/jBnz3MjTzX,"""http://twitter.com/download/iphone"" rel=""nofollow"">Twitter for iPhone</a>",213.0,634.0,False,False,https://pbs.twimg.com/media/CU9N6upXAAAbtQe.jpg,1,Shih-Tzu,0.963622,True,Lhasa,0.0160167,True,guinea_pig,0.00793192,False,floofer,None,1.0,10.0/10.0
670811965569282048,2015-11-29,Meet Maggie. She enjoys her stick in the yard. Very content. Much tranquility. 10/10 keep it up pup https://t.co/eYP9i9gfYn,"""http://twitter.com/download/iphone"" rel=""nofollow"">Twitter for iPhone</a>",10.0,10.0,Maggie,2015-11-29,Meet Maggie. She enjoys her stick in the yard. Very content. Much tranquility. 10/10 keep it up pup https://t.co/eYP9i9gfYn,"""http://twitter.com/download/iphone"" rel=""nofollow"">Twitter for iPhone</a>",295.0,1202.0,False,False,https://pbs.twimg.com/media/CU8z65IUEAQBc4q.jpg,1,basset,0.99409,True,Walker_hound,0.00397268,True,beagle,0.00140619,True,floofer,None,1.0,10.0/10.0
670804601705242624,2015-11-29,Meet Mason. He's a total frat boy. Pretends to be Hawaiian. Head is unbelievably round. 10/10 would pet so damn well https://t.co/DM3ZP3AA7b,"""http://twitter.com/download/iphone"" rel=""nofollow"">Twitter for iPhone</a>",10.0,10.0,Mason,2015-11-29,Meet Mason. He's a total frat boy. Pretends to be Hawaiian. Head is unbelievably round. 10/10 would pet so damn well https://t.co/DM3ZP3AA7b,"""http://twitter.com/download/iphone"" rel=""nofollow"">Twitter for iPhone</a>",1035.0,2098.0,False,False,https://pbs.twimg.com/media/CU8tOJZWUAAlNoF.jpg,1,Pomeranian,0.86856,True,Pekinese,0.0901291999999999,True,chow,0.0217220999999999,True,floofer,None,1.0,10.0/10.0
670797304698376195,2015-11-29,This is Trigger. He was minding his own business on stair when he overheard someone say they don't like bacon. 11/10 https://t.co/yqohZK4CL0,"""http://twitter.com/download/iphone"" rel=""nofollow"">Twitter for iPhone</a>",11.0,10.0,Trigger,2015-11-29,This is Trigger. He was minding his own business on stair when he overheard someone say they don't like bacon. 11/10 https://t.co/yqohZK4CL0,"""http://twitter.com/download/iphone"" rel=""nofollow"">Twitter for iPhone</a>",262.0,780.0,False,False,https://pbs.twimg.com/media/CU8mlhoVAAAteS5.jpg,1,Pembroke,0.472197,True,beagle,0.090938,True,German_shepherd,0.0643659999999999,True,floofer,None,1.1,11.0/10.0
670764103623966721,2015-11-29,Meet Vincent. He's a wild Adderall Cayenne. Shipped for free. Always fresh. Never frozen. 10/10 great purchase https://t.co/ZfS7chSsi7,"""http://twitter.com/download/iphone"" rel=""nofollow"">Twitter for iPhone</a>",10.0,10.0,Vincent,2015-11-29,Meet Vincent. He's a wild Adderall Cayenne. Shipped for free. Always fresh. Never frozen. 10/10 great purchase https://t.co/ZfS7chSsi7,"""http://twitter.com/download/iphone"" rel=""nofollow"">Twitter for iPhone</a>",466.0,1154.0,False,False,https://pbs.twimg.com/media/CU8IY0pWIAA2AJ-.jpg,1,Norfolk_terrier,0.17285,True,golden_retriever,0.0727022,True,television,0.0374942,False,floofer,None,1.0,10.0/10.0
671547767500775424,2015-12-01,This is Marley. She chews shoes then feels extremely guilty about it and refuses to look at them. 10/10 https://t.co/f99MV0htAV,"""http://twitter.com/download/iphone"" rel=""nofollow"">Twitter for iPhone</a>",10.0,10.0,Marley,2015-12-01,This is Marley. She chews shoes then feels extremely guilty about it and refuses to look at them. 10/10 https://t.co/f99MV0htAV,"""http://twitter.com/download/iphone"" rel=""nofollow"">Twitter for iPhone</a>",658.0,1444.0,False,False,https://pbs.twimg.com/media/CVHRIiqWEAAj98K.jpg,2,Loafer,0.255088,False,platypus,0.0900191,False,cowboy_boot,0.066536,False,floofer,None,1.0,10.0/10.0
683391852557561860,2016-01-02,"Say hello to Jack (pronounced ""Kevin""). He's a Virgo Episcopalian. Can summon rainbows. 11/10 magical as hell https://t.co/YHXrdUTHd6","""http://twitter.com/download/iphone"" rel=""nofollow"">Twitter for iPhone</a>",11.0,10.0,Jack,2016-01-02,"Say hello to Jack (pronounced ""Kevin""). He's a Virgo Episcopalian. Can summon rainbows. 11/10 magical as hell https://t.co/YHXrdUTHd6","""http://twitter.com/download/iphone"" rel=""nofollow"">Twitter for iPhone</a>",2702.0,8356.0,False,False,https://pbs.twimg.com/media/CXvlQ2zW8AAE0tp.jpg,1,French_bulldog,0.992833,True,Boston_bull,0.00474863,True,pug,0.00139169,True,floofer,None,1.1,11.0/10.0
889638837579907072,2017-07-25,This is Ted. He does his best. Sometimes that's not enough. But it's ok. 12/10 would assist https://t.co/f8dEDcrKSR,"""http://twitter.com/download/iphone"" rel=""nofollow"">Twitter for iPhone</a>",12.0,10.0,Ted,2017-07-25,This is Ted. He does his best. Sometimes that's not enough. But it's ok. 12/10 would assist https://t.co/f8dEDcrKSR,"""http://twitter.com/download/iphone"" rel=""nofollow"">Twitter for iPhone</a>",4735.0,27672.0,False,False,https://pbs.twimg.com/media/DFihzFfXsAYGDPR.jpg,1,French_bulldog,0.99165,True,boxer,0.00212864,True,Staffordshire_bullterrier,0.00149818,True,puppo,None,1.2,12.0/10.0
683498322573824003,2016-01-03,This is Griffin. He's desperate for both a physical and emotion connection. 11/10 I'd hug the hell out of Griffin https://t.co/ObWcOEekt0,"""http://twitter.com/download/iphone"" rel=""nofollow"">Twitter for iPhone</a>",11.0,10.0,Griffin,2016-01-03,This is Griffin. He's desperate for both a physical and emotion connection. 11/10 I'd hug the hell out of Griffin https://t.co/ObWcOEekt0,"""http://twitter.com/download/iphone"" rel=""nofollow"">Twitter for iPhone</a>",1095.0,3469.0,False,False,https://pbs.twimg.com/media/CXxGGOsUwAAr62n.jpg,1,Airedale,0.945362,True,Irish_terrier,0.02685,True,Lakeland_terrier,0.0168264,True,floofer,None,1.1,11.0/10.0
700505138482569216,2016-02-19,This is Kaia. She's just cute as hell. 12/10 I'd kill for Kaia https://t.co/5fMdH8GFaq,"""http://twitter.com/download/iphone"" rel=""nofollow"">Twitter for iPhone</a>",12.0,10.0,Kaia,2016-02-19,This is Kaia. She's just cute as hell. 12/10 I'd kill for Kaia https://t.co/5fMdH8GFaq,"""http://twitter.com/download/iphone"" rel=""nofollow"">Twitter for iPhone</a>",646.0,2487.0,False,False,https://pbs.twimg.com/media/Cbixs3vUUAAqHHN.jpg,1,bath_towel,0.449684,False,Norwegian_elkhound,0.160205,True,Great_Dane,0.0486658,True,floofer,None,1.2,12.0/10.0
700167517596164096,2016-02-18,This is Dotsy. She's stuck as hell. 10/10 https://t.co/A0h4lnhU4s,"""http://twitter.com/download/iphone"" rel=""nofollow"">Twitter for iPhone</a>",10.0,10.0,Dotsy,2016-02-18,This is Dotsy. She's stuck as hell. 10/10 https://t.co/A0h4lnhU4s,"""http://twitter.com/download/iphone"" rel=""nofollow"">Twitter for iPhone</a>",836.0,2903.0,False,False,https://pbs.twimg.com/media/Cbd-o8hWwAE4OFm.jpg,1,beagle,0.1625849999999999,True,Pembroke,0.1204809999999999,True,Siberian_husky,0.110284,True,floofer,None,1.0,10.0/10.0
700029284593901568,2016-02-17,This is Coops. His ship is taking on water. Sound the alarm. Much distress. Requesting immediate assistance. 10/10 https://t.co/8Nuny4lLE3,"""http://twitter.com/download/iphone"" rel=""nofollow"">Twitter for iPhone</a>",10.0,10.0,Coops,2016-02-17,This is Coops. His ship is taking on water. Sound the alarm. Much distress. Requesting immediate assistance. 10/10 https://t.co/8Nuny4lLE3,"""http://twitter.com/download/iphone"" rel=""nofollow"">Twitter for iPhone</a>",661.0,2262.0,False,False,https://pbs.twimg.com/media/CbcA673XIAAsytQ.jpg,1,West_Highland_white_terrier,0.726571,True,Maltese_dog,0.1768279999999999,True,Dandie_Dinmont,0.0701338,True,floofer,None,1.0,10.0/10.0
699413908797464576,2016-02-16,"Meet Miley. She's a Scandinavian Hollabackgirl. Incalculably fluffy, unamused af. 11/10 would squeeze aggressively https://t.co/6r4GFZY5WS","""http://twitter.com/download/iphone"" rel=""nofollow"">Twitter for iPhone</a>",11.0,10.0,Miley,2016-02-16,"Meet Miley. She's a Scandinavian Hollabackgirl. Incalculably fluffy, unamused af. 11/10 would squeeze aggressively https://t.co/6r4GFZY5WS","""http://twitter.com/download/iphone"" rel=""nofollow"">Twitter for iPhone</a>",688.0,2258.0,False,False,https://pbs.twimg.com/media/CbTRPXdW8AQMZf7.jpg,1,Samoyed,0.517479,True,malamute,0.155935,True,Eskimo_dog,0.0950008999999999,True,floofer,None,1.1,11.0/10.0
698342080612007937,2016-02-13,This is Maximus. He's training for the tetherball world championship. The grind never stops. 11/10 (vid by @Amuly21) https://t.co/VmFfWMjNkp,"""http://twitter.com/download/iphone"" rel=""nofollow"">Twitter for iPhone</a>",11.0,10.0,Maximus,2016-02-13,This is Maximus. He's training for the tetherball world championship. The grind never stops. 11/10 (vid by @Amuly21) https://t.co/VmFfWMjNkp,"""http://twitter.com/download/iphone"" rel=""nofollow"">Twitter for iPhone</a>",1074.0,2485.0,False,False,https://pbs.twimg.com/ext_tw_video_thumb/698341973569245184/pu/img/Sj3A2vSfbKWSv61T.jpg,1,boxer,0.8830479999999999,True,Saint_Bernard,0.0305794,True,Staffordshire_bullterrier,0.0129941,True,floofer,None,1.1,11.0/10.0
697943111201378304,2016-02-12,This is Cassie. She goes door to door trying to find the owner of this baguette. No luck so far. 10/10 https://t.co/e8bj97CisO,"""http://twitter.com/download/iphone"" rel=""nofollow"">Twitter for iPhone</a>",10.0,10.0,Cassie,2016-02-12,This is Cassie. She goes door to door trying to find the owner of this baguette. No luck so far. 10/10 https://t.co/e8bj97CisO,"""http://twitter.com/download/iphone"" rel=""nofollow"">Twitter for iPhone</a>",776.0,2638.0,False,False,https://pbs.twimg.com/media/Ca-XjfiUsAAUa8f.jpg,1,Great_Dane,0.126924,True,Greater_Swiss_Mountain_dog,0.110037,True,German_short-haired_pointer,0.090816,True,floofer,None,1.0,10.0/10.0
697242256848379904,2016-02-10,This is Oakley. He has a massive tumor growing on his head. Seems benign tho. 10/10 would pet around tumor https://t.co/7GQ7BTxywN,"""http://twitter.com/download/iphone"" rel=""nofollow"">Twitter for iPhone</a>",10.0,10.0,Oakley,2016-02-10,This is Oakley. He has a massive tumor growing on his head. Seems benign tho. 10/10 would pet around tumor https://t.co/7GQ7BTxywN,"""http://twitter.com/download/iphone"" rel=""nofollow"">Twitter for iPhone</a>",751.0,2753.0,False,False,https://pbs.twimg.com/media/Ca0aIR9WcAAHiPy.jpg,1,grey_fox,0.236031,False,Siamese_cat,0.165791,False,Eskimo_dog,0.0635328,True,floofer,None,1.0,10.0/10.0
695409464418041856,2016-02-05,This is Bob. He just got back from his job interview and realized his ear was inside-out the whole time. 10/10 https://t.co/lORINwFXIV,"""http://twitter.com/download/iphone"" rel=""nofollow"">Twitter for iPhone</a>",10.0,10.0,Bob,2016-02-05,This is Bob. He just got back from his job interview and realized his ear was inside-out the whole time. 10/10 https://t.co/lORINwFXIV,"""http://twitter.com/download/iphone"" rel=""nofollow"">Twitter for iPhone</a>",4017.0,9460.0,False,False,https://pbs.twimg.com/media/CaaXN5LUYAEzAh-.jpg,1,pug,0.997445,True,bull_mastiff,0.00174855,True,Pekinese,0.000304404,True,floofer,None,1.0,10.0/10.0
694669722378485760,2016-02-02,This is Phil. He's an important dog. Can control the seasons. Magical as hell. 12/10 would let him sign my forehead https://t.co/9mb0P2rjk2,"""http://twitter.com/download/iphone"" rel=""nofollow"">Twitter for iPhone</a>",12.0,10.0,Phil,2016-02-02,This is Phil. He's an important dog. Can control the seasons. Magical as hell. 12/10 would let him sign my forehead https://t.co/9mb0P2rjk2,"""http://twitter.com/download/iphone"" rel=""nofollow"">Twitter for iPhone</a>",13517.0,26068.0,False,False,https://pbs.twimg.com/media/CaP2bS8WYAAsMdx.jpg,2,beaver,0.4570939999999999,False,mongoose,0.228298,False,marmot,0.148309,False,floofer,None,1.2,12.0/10.0
694352839993344000,2016-02-02,Meet Olivir. He takes killer selfies. Has a dog of his own. It leaps at random &amp; can't bark for shit. 10/10 &amp; 5/10 https://t.co/6NgsQJuSBJ,"""http://twitter.com/download/iphone"" rel=""nofollow"">Twitter for iPhone</a>",10.0,10.0,Olivir,2016-02-02,Meet Olivir. He takes killer selfies. Has a dog of his own. It leaps at random &amp; can't bark for shit. 10/10 &amp; 5/10 https://t.co/6NgsQJuSBJ,"""http://twitter.com/download/iphone"" rel=""nofollow"">Twitter for iPhone</a>",700.0,2244.0,False,False,https://pbs.twimg.com/media/CaLWOPfWkAAo2Dt.jpg,2,Australian_terrier,0.407886,True,Yorkshire_terrier,0.328173,True,silky_terrier,0.108404,True,floofer,None,1.0,10.0/10.0
693280720173801472,2016-01-30,This is Sadie and her 2 pups Shebang &amp; Ruffalo. Sadie says single parenting is challenging but rewarding. All 10/10 https://t.co/UzbhwXcLne,"""http://twitter.com/download/iphone"" rel=""nofollow"">Twitter for iPhone</a>",10.0,10.0,Sadie,2016-01-30,This is Sadie and her 2 pups Shebang &amp; Ruffalo. Sadie says single parenting is challenging but rewarding. All 10/10 https://t.co/UzbhwXcLne,"""http://twitter.com/download/iphone"" rel=""nofollow"">Twitter for iPhone</a>",1403.0,3669.0,False,False,https://pbs.twimg.com/media/CZ8HIsGWIAA9eXX.jpg,1,Labrador_retriever,0.340008,True,bull_mastiff,0.175316,True,box_turtle,0.1643369999999999,False,floofer,None,1.0,10.0/10.0
692894228850999298,2016-01-29,Meet Tupawc. He's actually a Christian rapper. Doesn't even understand the concept of dollar signs. 10/10 great guy https://t.co/mCqgtqLDCW,"""http://twitter.com/download/iphone"" rel=""nofollow"">Twitter for iPhone</a>",10.0,10.0,Tupawc,2016-01-29,Meet Tupawc. He's actually a Christian rapper. Doesn't even understand the concept of dollar signs. 10/10 great guy https://t.co/mCqgtqLDCW,"""http://twitter.com/download/iphone"" rel=""nofollow"">Twitter for iPhone</a>",910.0,2511.0,False,False,https://pbs.twimg.com/media/CZ2nn7BUsAI2Pj3.jpg,1,German_short-haired_pointer,0.876977,True,bluetick,0.0366151,True,basset,0.0178477,True,floofer,None,1.0,10.0/10.0
692535307825213440,2016-01-28,This is Amber. She's a Fetty Woof. 10/10 would pet in a heartbeat https://t.co/Dt360V2MYI,"""http://twitter.com/download/iphone"" rel=""nofollow"">Twitter for iPhone</a>",10.0,10.0,Amber,2016-01-28,This is Amber. She's a Fetty Woof. 10/10 would pet in a heartbeat https://t.co/Dt360V2MYI,"""http://twitter.com/download/iphone"" rel=""nofollow"">Twitter for iPhone</a>",1529.0,3504.0,False,False,https://pbs.twimg.com/media/CZxhL2yWAAI_DHn.jpg,1,pug,0.4130899999999999,True,French_bulldog,0.199865,True,Chihuahua,0.0819906,True,floofer,None,1.0,10.0/10.0
692187005137076224,2016-01-27,This is a rare Arctic Wubberfloof. Unamused by the happenings. No longer has the appetites. 12/10 would totally hug https://t.co/krvbacIX0N,"""http://twitter.com/download/iphone"" rel=""nofollow"">Twitter for iPhone</a>",12.0,10.0,a,2016-01-27,This is a rare Arctic Wubberfloof. Unamused by the happenings. No longer has the appetites. 12/10 would totally hug https://t.co/krvbacIX0N,"""http://twitter.com/download/iphone"" rel=""nofollow"">Twitter for iPhone</a>",929.0,2768.0,False,False,https://pbs.twimg.com/media/CZskaEIWIAUeTr5.jpg,2,Siberian_husky,0.810592,True,malamute,0.119745,True,Eskimo_dog,0.0292647999999999,True,floofer,None,1.2,12.0/10.0
691675652215414786,2016-01-25,This is Richie and Plip. They are the best of pals. Do everything together. 10/10 for both https://t.co/KMdwNgONkV,"""http://twitter.com/download/iphone"" rel=""nofollow"">Twitter for iPhone</a>",10.0,10.0,Richie,2016-01-25,This is Richie and Plip. They are the best of pals. Do everything together. 10/10 for both https://t.co/KMdwNgONkV,"""http://twitter.com/download/iphone"" rel=""nofollow"">Twitter for iPhone</a>",577.0,2116.0,False,False,https://pbs.twimg.com/media/CZlTVL4WkAEpVR5.jpg,1,Chihuahua,0.182898,True,teddy,0.128077,False,West_Highland_white_terrier,0.0978748,True,floofer,None,1.0,10.0/10.0
691459709405118465,2016-01-25,Say hello to Leo. He's a Fallopian Puffalope. Precious af. 12/10 would cuddle https://t.co/LZEi0DpRsH,"""http://twitter.com/download/iphone"" rel=""nofollow"">Twitter for iPhone</a>",12.0,10.0,Leo,2016-01-25,Say hello to Leo. He's a Fallopian Puffalope. Precious af. 12/10 would cuddle https://t.co/LZEi0DpRsH,"""http://twitter.com/download/iphone"" rel=""nofollow"">Twitter for iPhone</a>",1294.0,4449.0,False,False,https://pbs.twimg.com/media/CZiO7mWUEAAa4zo.jpg,1,Shetland_sheepdog,0.5512060000000001,True,collie,0.232544,True,Border_collie,0.0952182,True,floofer,None,1.2,12.0/10.0
690690673629138944,2016-01-23,This is Cedrick. He's a spookster. Did me a discomfort. 10/10 would pet with a purpose https://t.co/yS7T4gxKod,"""http://twitter.com/download/iphone"" rel=""nofollow"">Twitter for iPhone</a>",10.0,10.0,Cedrick,2016-01-23,This is Cedrick. He's a spookster. Did me a discomfort. 10/10 would pet with a purpose https://t.co/yS7T4gxKod,"""http://twitter.com/download/iphone"" rel=""nofollow"">Twitter for iPhone</a>",898.0,2547.0,False,False,https://pbs.twimg.com/media/CZXTgKkWwAA5UZJ.jpg,1,bath_towel,0.1945319999999999,False,radiator,0.127776,False,Maltese_dog,0.0896246,True,floofer,None,1.0,10.0/10.0
690400367696297985,2016-01-22,"This is Eriq. His friend just reminded him of last year's super bowl. Not cool friend
10/10 for Eriq
6/10 for friend https://t.co/PlEXTofdpf","""http://twitter.com/download/iphone"" rel=""nofollow"">Twitter for iPhone</a>",10.0,10.0,Eriq,2016-01-22,"This is Eriq. His friend just reminded him of last year's super bowl. Not cool friend
10/10 for Eriq
6/10 for friend https://t.co/PlEXTofdpf","""http://twitter.com/download/iphone"" rel=""nofollow"">Twitter for iPhone</a>",509.0,2041.0,False,False,https://pbs.twimg.com/media/CZTLeBuWIAAFkeR.jpg,1,Pembroke,0.426459,True,papillon,0.317368,True,Shetland_sheepdog,0.0776159999999999,True,floofer,None,1.0,10.0/10.0
690248561355657216,2016-01-21,This is Maxwell. That's his moped. He rents it out for others to use as long as he can come also. 11/10 great dog https://t.co/IF5kKaO945,"""http://twitter.com/download/iphone"" rel=""nofollow"">Twitter for iPhone</a>",11.0,10.0,Maxwell,2016-01-21,This is Maxwell. That's his moped. He rents it out for others to use as long as he can come also. 11/10 great dog https://t.co/IF5kKaO945,"""http://twitter.com/download/iphone"" rel=""nofollow"">Twitter for iPhone</a>",477.0,1845.0,False,False,https://pbs.twimg.com/media/CZRBZ9mWkAAWblt.jpg,1,motor_scooter,0.38269,False,moped,0.318017,False,pickup,0.0406254,False,floofer,None,1.1,11.0/10.0
700747788515020802,2016-02-19,We only rate dogs. Pls stop sending in non-canines like this Mongolian grass snake. This is very frustrating. 11/10 https://t.co/22x9SbCYCU,"""http://twitter.com/download/iphone"" rel=""nofollow"">Twitter for iPhone</a>",11.0,10.0,very,2016-02-19,We only rate dogs. Pls stop sending in non-canines like this Mongolian grass snake. This is very frustrating. 11/10 https://t.co/22x9SbCYCU,"""http://twitter.com/download/iphone"" rel=""nofollow"">Twitter for iPhone</a>",10673.0,25130.0,False,False,https://pbs.twimg.com/media/CbmOY41UAAQylmA.jpg,1,Great_Pyrenees,0.481333,True,Samoyed,0.311769,True,Maltese_dog,0.0749621,True,floofer,None,1.1,11.0/10.0
700847567345688576,2016-02-20,Meet Crouton. He's a Galapagos Boonwiddle. Has a legendary tongue (most Boonwiddles do). Excellent stuff 10/10 https://t.co/110Eeg7KW3,"""http://twitter.com/download/iphone"" rel=""nofollow"">Twitter for iPhone</a>",10.0,10.0,Crouton,2016-02-20,Meet Crouton. He's a Galapagos Boonwiddle. Has a legendary tongue (most Boonwiddles do). Excellent stuff 10/10 https://t.co/110Eeg7KW3,"""http://twitter.com/download/iphone"" rel=""nofollow"">Twitter for iPhone</a>",558.0,2637.0,False,False,https://pbs.twimg.com/media/CbnpI_1XIAAiRAz.jpg,1,Rhodesian_ridgeback,0.2525139999999999,True,redbone,0.153005,True,whippet,0.135199,True,floofer,None,1.0,10.0/10.0
700890391244103680,2016-02-20,This is Chet. He's dapper af. His owners want him to learn how to dance but his true passion is potato guns. 11/10 https://t.co/TBv7Qh1zxZ,"""http://twitter.com/download/iphone"" rel=""nofollow"">Twitter for iPhone</a>",11.0,10.0,Chet,2016-02-20,This is Chet. He's dapper af. His owners want him to learn how to dance but his true passion is potato guns. 11/10 https://t.co/TBv7Qh1zxZ,"""http://twitter.com/download/iphone"" rel=""nofollow"">Twitter for iPhone</a>",653.0,2437.0,False,False,https://pbs.twimg.com/media/CboQFolWIAE04qE.jpg,1,white_wolf,0.166563,False,schipperke,0.1223559999999999,True,West_Highland_white_terrier,0.119247,True,floofer,None,1.1,11.0/10.0
708711088997666817,2016-03-12,This is Smokey. He really likes tennis balls. 11/10 https://t.co/Ah7WlYTUBQ,"""http://twitter.com/download/iphone"" rel=""nofollow"">Twitter for iPhone</a>",11.0,10.0,Smokey,2016-03-12,This is Smokey. He really likes tennis balls. 11/10 https://t.co/Ah7WlYTUBQ,"""http://twitter.com/download/iphone"" rel=""nofollow"">Twitter for iPhone</a>",834.0,2790.0,False,False,https://pbs.twimg.com/media/CdXY-GHWoAALing.jpg,2,tennis_ball,0.912961,False,German_short-haired_pointer,0.0526946,True,Labrador_retriever,0.0184774,True,floofer,None,1.1,11.0/10.0
708469915515297792,2016-03-12,This is Bobble. He's a Croatian Galifianakis. Hears everything within 400 miles. 11/10 would snug diligently https://t.co/VwDc6PTDzk,"""http://twitter.com/download/iphone"" rel=""nofollow"">Twitter for iPhone</a>",11.0,10.0,Bobble,2016-03-12,This is Bobble. He's a Croatian Galifianakis. Hears everything within 400 miles. 11/10 would snug diligently https://t.co/VwDc6PTDzk,"""http://twitter.com/download/iphone"" rel=""nofollow"">Twitter for iPhone</a>",926.0,3357.0,False,False,https://pbs.twimg.com/media/CdT9n7mW0AQcpZU.jpg,1,Chihuahua,0.748163,True,toy_terrier,0.127717,True,Pembroke,0.042141,True,floofer,None,1.1,11.0/10.0
708356463048204288,2016-03-11,This is Oliver. That is his castle. He protects it with his life. He's also squishy af. 10/10 would squish softly https://t.co/oSuEGw0BhX,"""http://twitter.com/download/iphone"" rel=""nofollow"">Twitter for iPhone</a>",10.0,10.0,Oliver,2016-03-11,This is Oliver. That is his castle. He protects it with his life. He's also squishy af. 10/10 would squish softly https://t.co/oSuEGw0BhX,"""http://twitter.com/download/iphone"" rel=""nofollow"">Twitter for iPhone</a>",1520.0,3929.0,False,False,https://pbs.twimg.com/media/CdSWcc1XIAAXc6H.jpg,2,pug,0.871283,True,French_bulldog,0.0418199999999999,True,bath_towel,0.015228,False,floofer,None,1.0,10.0/10.0
708149363256774660,2016-03-11,This is Jebberson. He's the reigning hide and seek world champion. 10/10 hasn't lost his touch https://t.co/VEFkvWCoHF,"""http://twitter.com/download/iphone"" rel=""nofollow"">Twitter for iPhone</a>",10.0,10.0,Jebberson,2016-03-11,This is Jebberson. He's the reigning hide and seek world champion. 10/10 hasn't lost his touch https://t.co/VEFkvWCoHF,"""http://twitter.com/download/iphone"" rel=""nofollow"">Twitter for iPhone</a>",1727.0,4672.0,False,False,https://pbs.twimg.com/media/CdPaEkHW8AA-Wom.jpg,1,Cardigan,0.350993,True,basset,0.164555,True,toy_terrier,0.0804836,True,floofer,None,1.0,10.0/10.0
707776935007539200,2016-03-10,This is Sadie. She's a Bohemian Rhapsody. Remarkably portable. Could sneak on roller coasters with (probably). 11/10 https://t.co/DB8fyeDs8B,"""http://twitter.com/download/iphone"" rel=""nofollow"">Twitter for iPhone</a>",11.0,10.0,Sadie,2016-03-10,This is Sadie. She's a Bohemian Rhapsody. Remarkably portable. Could sneak on roller coasters with (probably). 11/10 https://t.co/DB8fyeDs8B,"""http://twitter.com/download/iphone"" rel=""nofollow"">Twitter for iPhone</a>",1079.0,3593.0,False,False,https://pbs.twimg.com/media/CdKHWimWoAABs08.jpg,1,miniature_pinscher,0.890426,True,toy_terrier,0.0513347,True,Chihuahua,0.0180152999999999,True,floofer,None,1.1,11.0/10.0
707387676719185920,2016-03-09,Meet Clarkus. He's a Skinny Eastern Worcestershire. Can tie own shoes (impressive af) 10/10 would put on track team https://t.co/XP5o7zGn0E,"""http://twitter.com/download/iphone"" rel=""nofollow"">Twitter for iPhone</a>",10.0,10.0,Clarkus,2016-03-09,Meet Clarkus. He's a Skinny Eastern Worcestershire. Can tie own shoes (impressive af) 10/10 would put on track team https://t.co/XP5o7zGn0E,"""http://twitter.com/download/iphone"" rel=""nofollow"">Twitter for iPhone</a>",1490.0,3835.0,False,False,https://pbs.twimg.com/media/CdElVm7XEAADP6o.jpg,1,Chihuahua,0.888468,True,Italian_greyhound,0.0886346,True,toy_terrier,0.0159383,True,floofer,None,1.0,10.0/10.0
