tweet_id,date_x,text,source_x,rating_numerator,rating_denominator,name,date_y,full_text,source_y,retweet_count,favorite_count,favorited,retweeted,image_url,img_num,prediction_image,prediction1_confidence,prediction1_dog,prediction2_image,prediction2_confidence,prediction2_dog,Prediction3_image,prediction3_confidence,prediction3_dog,stages,dog_stage_values,rating_number,rating
852672615818899456,2017-04-13,This is Aspen. She's never tasted a stick so succulent. On the verge of tears. A face of pure appreciation. 12/10 https://t.co/VlyBzOXHEW,"""http://twitter.com/download/iphone"" rel=""nofollow"">Twitter for iPhone</a>",12.0,10.0,Aspen,2017-04-13,This is Aspen. She's never tasted a stick so succulent. On the verge of tears. A face of pure appreciation. 12/10 https://t.co/VlyBzOXHEW,"""http://twitter.com/download/iphone"" rel=""nofollow"">Twitter for iPhone</a>",2388.0,15939.0,False,False,https://pbs.twimg.com/media/C9VNNp1XkAEWRFb.jpg,1,golden_retriever,0.7112350000000001,True,otterhound,0.0682347,True,Sussex_spaniel,0.0465617,True,doggo,None,1.2,12.0/10.0
852189679701164033,2017-04-12,This is Sailor. He has collected the best dirt in the area. As any good boy would. Under the impression you know what to do next. 12/10 https://t.co/jrFzScKWEG,"""http://twitter.com/download/iphone"" rel=""nofollow"">Twitter for iPhone</a>",12.0,10.0,Sailor,2017-04-12,This is Sailor. He has collected the best dirt in the area. As any good boy would. Under the impression you know what to do next. 12/10 https://t.co/jrFzScKWEG,"""http://twitter.com/download/iphone"" rel=""nofollow"">Twitter for iPhone</a>",1741.0,12217.0,False,False,https://pbs.twimg.com/media/C9OV99SXsAEmj1U.jpg,1,barrow,0.42315,False,Bernese_mountain_dog,0.4153739999999999,True,EntleBucher,0.0673454,True,doggo,None,1.2,12.0/10.0
850753642995093505,2017-04-08,"This is Kyle. He made a joke about your shoes, then stuck his tongue out at you. Uncalled for. Step the h*ck up Kyle. 11/10 would forgive https://t.co/hLQ2Ilg2uN","""http://twitter.com/download/iphone"" rel=""nofollow"">Twitter for iPhone</a>",11.0,10.0,Kyle,2017-04-08,"This is Kyle. He made a joke about your shoes, then stuck his tongue out at you. Uncalled for. Step the h*ck up Kyle. 11/10 would forgive https://t.co/hLQ2Ilg2uN","""http://twitter.com/download/iphone"" rel=""nofollow"">Twitter for iPhone</a>",10352.0,33348.0,False,False,https://pbs.twimg.com/media/C8576jrW0AEYWFy.jpg,1,pug,0.996952,True,bull_mastiff,0.000995901,True,French_bulldog,0.00088338,True,doggo,None,1.1,11.0/10.0
847962785489326080,2017-04-01,This is Georgie. He's very shy. Only puppears when called. Aggressively average at fetch. Unique front paws. Looks slippery. 10/10 would pet https://t.co/rcDs5LkiSj,"""http://twitter.com/download/iphone"" rel=""nofollow"">Twitter for iPhone</a>",10.0,10.0,Georgie,2017-04-01,This is Georgie. He's very shy. Only puppears when called. Aggressively average at fetch. Unique front paws. Looks slippery. 10/10 would pet https://t.co/rcDs5LkiSj,"""http://twitter.com/download/iphone"" rel=""nofollow"">Twitter for iPhone</a>",5730.0,25296.0,False,False,https://pbs.twimg.com/media/C8SRpHNUIAARB3j.jpg,1,sea_lion,0.882654,False,mink,0.0668802,False,otter,0.0256787,False,doggo,None,1.0,10.0/10.0
847251039262605312,2017-03-30,This is Furzey. He's doing an elevated sandy zoom. Adjusts ears to steer. 12/10 would pet mid flight https://t.co/zhbRIZQgnq,"""http://twitter.com/download/iphone"" rel=""nofollow"">Twitter for iPhone</a>",12.0,10.0,Furzey,2017-03-30,This is Furzey. He's doing an elevated sandy zoom. Adjusts ears to steer. 12/10 would pet mid flight https://t.co/zhbRIZQgnq,"""http://twitter.com/download/iphone"" rel=""nofollow"">Twitter for iPhone</a>",4800.0,22036.0,False,False,https://pbs.twimg.com/media/C8IKUjAUwAEP-En.jpg,1,Airedale,0.49538,True,Irish_terrier,0.316456,True,Lakeland_terrier,0.1585329999999999,True,doggo,None,1.2,12.0/10.0
846042936437604353,2017-03-26,Meet Jarvis. The snow pupsets him. Officially ready for summer. 12/10 would perform a chilly boop https://t.co/0hLkztpiOW,"""http://twitter.com/download/iphone"" rel=""nofollow"">Twitter for iPhone</a>",12.0,10.0,Jarvis,2017-03-26,Meet Jarvis. The snow pupsets him. Officially ready for summer. 12/10 would perform a chilly boop https://t.co/0hLkztpiOW,"""http://twitter.com/download/iphone"" rel=""nofollow"">Twitter for iPhone</a>",3224.0,17256.0,False,False,https://pbs.twimg.com/media/C72_iaUVUAEhZSn.jpg,1,golden_retriever,0.96111,True,Labrador_retriever,0.0166952,True,Tibetan_mastiff,0.00908153,True,doggo,None,1.2,12.0/10.0
844973813909606400,2017-03-23,"This is Brady. He's a recovering alcoholic. Demonstrating incredible restraint here. 12/10 don't give pup, don't give in, Brady https://t.co/B1iBuSq3hr","""http://twitter.com/download/iphone"" rel=""nofollow"">Twitter for iPhone</a>",12.0,10.0,Brady,2017-03-23,"This is Brady. He's a recovering alcoholic. Demonstrating incredible restraint here. 12/10 don't give pup, don't give in, Brady https://t.co/B1iBuSq3hr","""http://twitter.com/download/iphone"" rel=""nofollow"">Twitter for iPhone</a>",3617.0,16361.0,False,False,https://pbs.twimg.com/media/C7nzMwTV4AARz4t.jpg,1,Labrador_retriever,0.742421,True,golden_retriever,0.195218,True,Chihuahua,0.0173200999999999,True,doggo,None,1.2,12.0/10.0
844580511645339650,2017-03-22,This is Charlie. He wants to know if you have a moment to talk about washing machine insurance policies. 11/10 would hear him out https://t.co/gAzPqT7uyk,"""http://twitter.com/download/iphone"" rel=""nofollow"">Twitter for iPhone</a>",11.0,10.0,Charlie,2017-03-22,This is Charlie. He wants to know if you have a moment to talk about washing machine insurance policies. 11/10 would hear him out https://t.co/gAzPqT7uyk,"""http://twitter.com/download/iphone"" rel=""nofollow"">Twitter for iPhone</a>",3533.0,17871.0,False,False,https://pbs.twimg.com/media/C7iNfq1W0AAcbsR.jpg,1,washer,0.903064,False,dishwasher,0.032489,False,printer,0.0164562,False,doggo,None,1.1,11.0/10.0
843604394117681152,2017-03-19,This is Hank. He's been outside for 3 minutes and already made a friend. Way to go Hank. 11/10 for both https://t.co/wHUElL84RC,"""http://twitter.com/download/iphone"" rel=""nofollow"">Twitter for iPhone</a>",11.0,10.0,Hank,2017-03-19,This is Hank. He's been outside for 3 minutes and already made a friend. Way to go Hank. 11/10 for both https://t.co/wHUElL84RC,"""http://twitter.com/download/iphone"" rel=""nofollow"">Twitter for iPhone</a>",3081.0,18310.0,False,False,https://pbs.twimg.com/media/C7UVuE_U0AI8GGl.jpg,1,Labrador_retriever,0.430583,True,golden_retriever,0.263581,True,Great_Pyrenees,0.179385,True,doggo,None,1.1,11.0/10.0
842765311967449089,2017-03-17,"Meet Indie. She's not a fan of baths but she's definitely a fan of hide &amp; seek. 12/10 click the link to help Indie

https://t.co/fvGkIuAlFK https://t.co/kiCFtmJd7l","""http://twitter.com/download/iphone"" rel=""nofollow"">Twitter for iPhone</a>",12.0,10.0,Indie,2017-03-17,"Meet Indie. She's not a fan of baths but she's definitely a fan of hide &amp; seek. 12/10 click the link to help Indie

https://t.co/fvGkIuAlFK https://t.co/kiCFtmJd7l","""http://twitter.com/download/iphone"" rel=""nofollow"">Twitter for iPhone</a>",1439.0,7321.0,False,False,https://pbs.twimg.com/media/C7IalMVX0AATKRD.jpg,1,tub,0.665238,False,bucket,0.105166,False,Labrador_retriever,0.0293399,True,doggo,None,1.2,12.0/10.0
842163532590374912,2017-03-16,Meet George. He looks slightly deflated but overall quite powerful. Not sure how that human restrained him. 12/10 would snug with permission https://t.co/o6E0hB3xZl,"""http://twitter.com/download/iphone"" rel=""nofollow"">Twitter for iPhone</a>",12.0,10.0,George,2017-03-16,Meet George. He looks slightly deflated but overall quite powerful. Not sure how that human restrained him. 12/10 would snug with permission https://t.co/o6E0hB3xZl,"""http://twitter.com/download/iphone"" rel=""nofollow"">Twitter for iPhone</a>",6568.0,26569.0,False,False,https://pbs.twimg.com/media/C6_3QgMWsAMNnAk.jpg,2,French_bulldog,0.891227,True,soccer_ball,0.022811,False,bull_mastiff,0.012852,True,doggo,None,1.2,12.0/10.0
840268004936019968,2017-03-10,This is Monty. He makes instantly regrettable decisions. Couldn't help himself. It looked like a ghost lollipop. 12/10 mistake happen https://t.co/8Wsr6b4RjE,"""http://twitter.com/download/iphone"" rel=""nofollow"">Twitter for iPhone</a>",12.0,10.0,Monty,2017-03-10,This is Monty. He makes instantly regrettable decisions. Couldn't help himself. It looked like a ghost lollipop. 12/10 mistake happen https://t.co/8Wsr6b4RjE,"""http://twitter.com/download/iphone"" rel=""nofollow"">Twitter for iPhone</a>",6497.0,20950.0,False,False,https://pbs.twimg.com/media/C6k7SaEXUAg83_J.jpg,3,Chesapeake_Bay_retriever,0.8639870000000001,True,Labrador_retriever,0.0526323,True,kelpie,0.0325736,True,doggo,None,1.2,12.0/10.0
854732716440526848,2017-04-19,This is Marlee. She fetched a flower and immediately requested that it be placed behind her ear. 12/10 elegant af https://t.co/nJztIEON5s,"""http://twitter.com/download/iphone"" rel=""nofollow"">Twitter for iPhone</a>",12.0,10.0,Marlee,2017-04-19,This is Marlee. She fetched a flower and immediately requested that it be placed behind her ear. 12/10 elegant af https://t.co/nJztIEON5s,"""http://twitter.com/download/iphone"" rel=""nofollow"">Twitter for iPhone</a>",6690.0,24188.0,False,False,https://pbs.twimg.com/media/C9ye3b3WAAAlTo0.jpg,1,Pembroke,0.6955479999999999,True,Cardigan,0.0589016999999999,True,chow,0.0284106,True,doggo,None,1.2,12.0/10.0
858107933456039936,2017-04-28,This is Wyatt. He had an interview earlier today. Was just told he didn't get the job. A h*ckin injustice. Still 12/10 keep your chin pup https://t.co/QXA4sCXSDF,"""http://twitter.com/download/iphone"" rel=""nofollow"">Twitter for iPhone</a>",12.0,10.0,Wyatt,2017-04-28,This is Wyatt. He had an interview earlier today. Was just told he didn't get the job. A h*ckin injustice. Still 12/10 keep your chin pup https://t.co/QXA4sCXSDF,"""http://twitter.com/download/iphone"" rel=""nofollow"">Twitter for iPhone</a>",3154.0,16524.0,False,False,https://pbs.twimg.com/media/C-icm_WXUAAmuRR.jpg,1,golden_retriever,0.863874,True,Labrador_retriever,0.01592,True,doormat,0.0106153,False,doggo,None,1.2,12.0/10.0
861005113778896900,2017-05-06,This is Burt. He thinks your thesis statement is comically underdeveloped. 12/10 intellectual af https://t.co/jH6EN9cEn6,"""http://twitter.com/download/iphone"" rel=""nofollow"">Twitter for iPhone</a>",12.0,10.0,Burt,2017-05-06,This is Burt. He thinks your thesis statement is comically underdeveloped. 12/10 intellectual af https://t.co/jH6EN9cEn6,"""http://twitter.com/download/iphone"" rel=""nofollow"">Twitter for iPhone</a>",4119.0,17538.0,False,False,https://pbs.twimg.com/media/C_LnlF5VoAEsL1K.jpg,1,German_shepherd,0.507951,True,Pembroke,0.136113,True,muzzle,0.0757641999999999,False,doggo,None,1.2,12.0/10.0
840632337062862849,2017-03-11,"Say hello to Maddie and Gunner. They are considerably pupset about bath time. Both 12/10 but Gunner needs your help

https://t.co/JesYTzb1Jo https://t.co/5cncH08G1o","""http://twitter.com/download/iphone"" rel=""nofollow"">Twitter for iPhone</a>",12.0,10.0,Maddie,2017-03-11,"Say hello to Maddie and Gunner. They are considerably pupset about bath time. Both 12/10 but Gunner needs your help

https://t.co/JesYTzb1Jo https://t.co/5cncH08G1o","""http://twitter.com/download/iphone"" rel=""nofollow"">Twitter for iPhone</a>",1972.0,9761.0,False,False,https://pbs.twimg.com/media/C6qGphPV4AEKrdc.jpg,1,golden_retriever,0.711148,True,cocker_spaniel,0.1579289999999999,True,Labrador_retriever,0.0595818999999999,True,floofer,None,1.2,12.0/10.0
666063827256086533,2015-11-16,This is the happiest dog you will ever see. Very committed owner. Nice couch. 10/10 https://t.co/RhUEAloehK,"""http://twitter.com/download/iphone"" rel=""nofollow"">Twitter for iPhone</a>",10.0,10.0,the,2015-11-16,This is the happiest dog you will ever see. Very committed owner. Nice couch. 10/10 https://t.co/RhUEAloehK,"""http://twitter.com/download/iphone"" rel=""nofollow"">Twitter for iPhone</a>",232.0,496.0,False,False,https://pbs.twimg.com/media/CT5Vg_wXIAAXfnj.jpg,1,golden_retriever,0.77593,True,Tibetan_mastiff,0.0937178,True,Labrador_retriever,0.0724266,True,floofer,None,1.0,10.0/10.0
888078434458587136,2017-07-20,This is Gerald. He was just told he didn't get the job he interviewed for. A h*ckin injustice. 12/10 didn't want the job anyway https://t.co/DK7iDPfuRX,"""http://twitter.com/download/iphone"" rel=""nofollow"">Twitter for iPhone</a>",12.0,10.0,Gerald,2017-07-20,This is Gerald. He was just told he didn't get the job he interviewed for. A h*ckin injustice. 12/10 didn't want the job anyway https://t.co/DK7iDPfuRX,"""http://twitter.com/download/iphone"" rel=""nofollow"">Twitter for iPhone</a>",3653.0,22201.0,False,False,https://pbs.twimg.com/media/DFMWn56WsAAkA7B.jpg,1,French_bulldog,0.995026,True,pug,0.000931908,True,bull_mastiff,0.000903211,True,doggo,None,1.2,12.0/10.0
884925521741709313,2017-07-12,"This is Earl. He found a hat. Nervous about what you think of it. 12/10 it's delightful, Earl https://t.co/MYJvdlNRVa","""http://twitter.com/download/iphone"" rel=""nofollow"">Twitter for iPhone</a>",12.0,10.0,Earl,2017-07-12,"This is Earl. He found a hat. Nervous about what you think of it. 12/10 it's delightful, Earl https://t.co/MYJvdlNRVa","""http://twitter.com/download/iphone"" rel=""nofollow"">Twitter for iPhone</a>",16439.0,68152.0,False,False,https://pbs.twimg.com/media/DEfjEaNXkAAtPlj.jpg,1,Italian_greyhound,0.259916,True,American_Staffordshire_terrier,0.198451,True,Staffordshire_bullterrier,0.127725,True,doggo,None,1.2,12.0/10.0
883838122936631299,2017-07-09,This is Noah. He can't believe someone made this mess. Got the vacuum out for you though. Offered to help clean pup. 12/10 super good boy https://t.co/V85xujjDDY,"""http://twitter.com/download/iphone"" rel=""nofollow"">Twitter for iPhone</a>",12.0,10.0,Noah,2017-07-09,This is Noah. He can't believe someone made this mess. Got the vacuum out for you though. Offered to help clean pup. 12/10 super good boy https://t.co/V85xujjDDY,"""http://twitter.com/download/iphone"" rel=""nofollow"">Twitter for iPhone</a>",3586.0,22349.0,False,False,https://pbs.twimg.com/media/DEQGFgAXUAAEvfi.jpg,1,Doberman,0.610946,True,miniature_pinscher,0.299603,True,kelpie,0.0630203,True,doggo,None,1.2,12.0/10.0
880465832366813184,2017-06-29,This is Bella. She had her first beach experience this morning. Complete success. 12/10 would perform a sandy boop https://t.co/4VsFysDmiw,"""http://twitter.com/download/iphone"" rel=""nofollow"">Twitter for iPhone</a>",12.0,10.0,Bella,2017-06-29,This is Bella. She had her first beach experience this morning. Complete success. 12/10 would perform a sandy boop https://t.co/4VsFysDmiw,"""http://twitter.com/download/iphone"" rel=""nofollow"">Twitter for iPhone</a>",6546.0,29075.0,False,False,https://pbs.twimg.com/media/DDgK-J4XUAIEV9W.jpg,1,golden_retriever,0.913255,True,Labrador_retriever,0.0263286,True,cocker_spaniel,0.00937082,True,doggo,None,1.2,12.0/10.0
874680097055178752,2017-06-13,Meet Cash. He hath acquired a stick. A very good stick tbh. 12/10 would pat head approvingly https://t.co/lZhtizkURD,"""http://twitter.com/download/iphone"" rel=""nofollow"">Twitter for iPhone</a>",12.0,10.0,Cash,2017-06-13,Meet Cash. He hath acquired a stick. A very good stick tbh. 12/10 would pat head approvingly https://t.co/lZhtizkURD,"""http://twitter.com/download/iphone"" rel=""nofollow"">Twitter for iPhone</a>",4875.0,28439.0,False,False,https://pbs.twimg.com/media/DCN85nGUwAAzG_q.jpg,1,Labrador_retriever,0.836052,True,Staffordshire_bullterrier,0.0470690999999999,True,beagle,0.0360071,True,doggo,None,1.2,12.0/10.0
868552278524837888,2017-05-27,"Say hello to Cooper. His expression is the same wet or dry. Absolute 12/10 but Coop desperately requests your help

https://t.co/ZMTE4Mr69f https://t.co/7RyeXTYLNi","""http://twitter.com/download/iphone"" rel=""nofollow"">Twitter for iPhone</a>",12.0,10.0,Cooper,2017-05-27,"Say hello to Cooper. His expression is the same wet or dry. Absolute 12/10 but Coop desperately requests your help

https://t.co/ZMTE4Mr69f https://t.co/7RyeXTYLNi","""http://twitter.com/download/iphone"" rel=""nofollow"">Twitter for iPhone</a>",2240.0,10539.0,False,False,https://pbs.twimg.com/media/DA23sCeVoAE3uF0.jpg,1,whippet,0.378151,True,Italian_greyhound,0.275935,True,American_Staffordshire_terrier,0.0949906,True,doggo,None,1.2,12.0/10.0
866686824827068416,2017-05-22,This is Lili. She can't believe you betrayed her with bath time. Never looking you in the eye again. 12/10 would puppologize profusely https://t.co/9b9J46E86Z,"""http://twitter.com/download/iphone"" rel=""nofollow"">Twitter for iPhone</a>",12.0,10.0,Lili,2017-05-22,This is Lili. She can't believe you betrayed her with bath time. Never looking you in the eye again. 12/10 would puppologize profusely https://t.co/9b9J46E86Z,"""http://twitter.com/download/iphone"" rel=""nofollow"">Twitter for iPhone</a>",3727.0,20070.0,False,False,https://pbs.twimg.com/media/DAcXEWuXkAIBDGJ.jpg,1,flat-coated_retriever,0.51473,True,groenendael,0.306407,True,curly-coated_retriever,0.0613140999999999,True,doggo,None,1.2,12.0/10.0
866334964761202691,2017-05-21,This is Coco. At first I thought she was a cloud but clouds don't bork with such passion. 12/10 would hug softly https://t.co/W86h5dgR6c,"""http://twitter.com/download/iphone"" rel=""nofollow"">Twitter for iPhone</a>",12.0,10.0,Coco,2017-05-21,This is Coco. At first I thought she was a cloud but clouds don't bork with such passion. 12/10 would hug softly https://t.co/W86h5dgR6c,"""http://twitter.com/download/iphone"" rel=""nofollow"">Twitter for iPhone</a>",15546.0,54720.0,False,False,https://pbs.twimg.com/media/DAXXDQNXgAAoYQH.jpg,1,Samoyed,0.984086,True,Pomeranian,0.00791928,True,keeshond,0.00332813,True,doggo,None,1.2,12.0/10.0
864279568663928832,2017-05-16,This is Meatball. He doing what's known in the industry as a mid-strut mlem. H*ckin fancy boy. 12/10 I'd do anything for Meatball https://t.co/S2HdmFFPck,"""http://twitter.com/download/iphone"" rel=""nofollow"">Twitter for iPhone</a>",12.0,10.0,Meatball,2017-05-16,This is Meatball. He doing what's known in the industry as a mid-strut mlem. H*ckin fancy boy. 12/10 I'd do anything for Meatball https://t.co/S2HdmFFPck,"""http://twitter.com/download/iphone"" rel=""nofollow"">Twitter for iPhone</a>",3266.0,15195.0,False,False,https://pbs.twimg.com/media/C_6JrWZVwAAHhCD.jpg,1,bull_mastiff,0.668613,True,French_bulldog,0.180562,True,Staffordshire_bullterrier,0.0522374,True,doggo,None,1.2,12.0/10.0
862722525377298433,2017-05-11,"This is Dave. He passed the h*ck out. It's barely the afternoon on a Thursday, Dave. Get it together. Still 11/10 would boop mid-snooze https://t.co/Eme9Uar6v2","""http://twitter.com/download/iphone"" rel=""nofollow"">Twitter for iPhone</a>",11.0,10.0,Dave,2017-05-11,"This is Dave. He passed the h*ck out. It's barely the afternoon on a Thursday, Dave. Get it together. Still 11/10 would boop mid-snooze https://t.co/Eme9Uar6v2","""http://twitter.com/download/iphone"" rel=""nofollow"">Twitter for iPhone</a>",3809.0,17779.0,False,False,https://pbs.twimg.com/media/C_kBjuUUIAArs2-.jpg,1,basset,0.39333,True,beagle,0.242034,True,boxer,0.0776925,True,doggo,None,1.1,11.0/10.0
859924526012018688,2017-05-04,Meet Milky. She has no idea what happened. Just as pupset as you. Perhaps a sheep exploded. Even offered to help clean. 12/10 very good girl https://t.co/g8vpXFzw29,"""http://twitter.com/download/iphone"" rel=""nofollow"">Twitter for iPhone</a>",12.0,10.0,Milky,2017-05-04,Meet Milky. She has no idea what happened. Just as pupset as you. Perhaps a sheep exploded. Even offered to help clean. 12/10 very good girl https://t.co/g8vpXFzw29,"""http://twitter.com/download/iphone"" rel=""nofollow"">Twitter for iPhone</a>",4349.0,20021.0,False,False,https://pbs.twimg.com/media/C-8QypZXcAAekaF.jpg,1,French_bulldog,0.254587,True,Staffordshire_bullterrier,0.1925579999999999,True,hog,0.10027,False,doggo,None,1.2,12.0/10.0
667806454573760512,2015-11-20,This is Filup. He is overcome with joy after finally meeting his father. 10/10 https://t.co/TBmDJXJB75,"""http://twitter.com/download/iphone"" rel=""nofollow"">Twitter for iPhone</a>",10.0,10.0,Filup,2015-11-20,This is Filup. He is overcome with joy after finally meeting his father. 10/10 https://t.co/TBmDJXJB75,"""http://twitter.com/download/iphone"" rel=""nofollow"">Twitter for iPhone</a>",535.0,1111.0,False,False,https://pbs.twimg.com/media/CUSGbXeVAAAgztZ.jpg,1,toyshop,0.253089,False,Chihuahua,0.187155,True,Brabancon_griffon,0.112799,True,doggo,None,1.0,10.0/10.0
667728196545200128,2015-11-20,Meet Olive. He comes to spot by tree to reminisce of simpler times and truly admire his place in the universe. 11/10 https://t.co/LwrCwlWwPB,"""http://twitter.com"" rel=""nofollow"">Twitter Web Client</a>",11.0,10.0,Olive,2015-11-20,Meet Olive. He comes to spot by tree to reminisce of simpler times and truly admire his place in the universe. 11/10 https://t.co/LwrCwlWwPB,"""http://twitter.com"" rel=""nofollow"">Twitter Web Client</a>",162.0,398.0,False,False,https://pbs.twimg.com/media/CUQ_QahUAAAVQjn.jpg,1,kuvasz,0.360159,True,golden_retriever,0.293744,True,Labrador_retriever,0.270673,True,doggo,None,1.1,11.0/10.0
667544320556335104,2015-11-20,"This is Kial. Kial is either wearing a cape, which would be rad, or flashing us, which would be rude. 10/10 or 4/10 https://t.co/8zcwIoiuqR","""http://twitter.com"" rel=""nofollow"">Twitter Web Client</a>",10.0,10.0,Kial,2015-11-20,"This is Kial. Kial is either wearing a cape, which would be rad, or flashing us, which would be rude. 10/10 or 4/10 https://t.co/8zcwIoiuqR","""http://twitter.com"" rel=""nofollow"">Twitter Web Client</a>",568.0,917.0,False,False,https://pbs.twimg.com/media/CUOYBbbWIAAXQGU.jpg,1,Pomeranian,0.412893,True,Pembroke,0.312958,True,Chihuahua,0.0719604,True,doggo,None,1.0,10.0/10.0
667470559035432960,2015-11-19,This is a northern Wahoo named Kohl. He runs this town. Chases tumbleweeds. Draws gun wicked fast. 11/10 legendary https://t.co/J4vn2rOYFk,"""http://twitter.com"" rel=""nofollow"">Twitter Web Client</a>",11.0,10.0,a,2015-11-19,This is a northern Wahoo named Kohl. He runs this town. Chases tumbleweeds. Draws gun wicked fast. 11/10 legendary https://t.co/J4vn2rOYFk,"""http://twitter.com"" rel=""nofollow"">Twitter Web Client</a>",102.0,273.0,False,False,https://pbs.twimg.com/media/CUNU78YWEAECmpB.jpg,1,toy_poodle,0.304175,True,pug,0.223427,True,Lakeland_terrier,0.0733164999999999,True,doggo,None,1.1,11.0/10.0
667453023279554560,2015-11-19,Meet Cupcake. I would do unspeakable things for Cupcake. 11/10 https://t.co/6uLCWR9Efa,"""http://twitter.com"" rel=""nofollow"">Twitter Web Client</a>",11.0,10.0,Cupcake,2015-11-19,Meet Cupcake. I would do unspeakable things for Cupcake. 11/10 https://t.co/6uLCWR9Efa,"""http://twitter.com"" rel=""nofollow"">Twitter Web Client</a>",96.0,327.0,False,False,https://pbs.twimg.com/media/CUNE_OSUwAAdHhX.jpg,1,Labrador_retriever,0.8256700000000001,True,French_bulldog,0.0566394,True,Staffordshire_bullterrier,0.0540183999999999,True,doggo,None,1.1,11.0/10.0
667200525029539841,2015-11-19,This is Joshwa. He is a fuckboy supreme. He clearly relies on owner but doesn't respect them. Dreamy eyes tho 11/10 https://t.co/60xYFRATPZ,"""http://twitter.com/download/iphone"" rel=""nofollow"">Twitter for iPhone</a>",11.0,10.0,Joshwa,2015-11-19,This is Joshwa. He is a fuckboy supreme. He clearly relies on owner but doesn't respect them. Dreamy eyes tho 11/10 https://t.co/60xYFRATPZ,"""http://twitter.com/download/iphone"" rel=""nofollow"">Twitter for iPhone</a>",282.0,658.0,False,False,https://pbs.twimg.com/media/CUJfVMPXIAAgbue.jpg,1,Siberian_husky,0.694904,True,malamute,0.232006,True,Eskimo_dog,0.0506351,True,doggo,None,1.1,11.0/10.0
667165590075940865,2015-11-19,This is Churlie. AKA Fetty Woof. Lost eye saving a school bus full of toddlers from a tsunami. Great guy. 10/10 https://t.co/li2XYBVuAY,"""http://twitter.com/download/iphone"" rel=""nofollow"">Twitter for iPhone</a>",10.0,10.0,Churlie,2015-11-19,This is Churlie. AKA Fetty Woof. Lost eye saving a school bus full of toddlers from a tsunami. Great guy. 10/10 https://t.co/li2XYBVuAY,"""http://twitter.com/download/iphone"" rel=""nofollow"">Twitter for iPhone</a>",1241.0,2819.0,False,False,https://pbs.twimg.com/media/CUI_kHBWsAAAef5.jpg,1,miniature_pinscher,0.140173,True,Rottweiler,0.134094,True,beagle,0.0818998,True,doggo,None,1.0,10.0/10.0
667119796878725120,2015-11-18,This is Gabe. He is a southern Baklava. Gabe has always wanted to fit in with the other bananas. 10/10 fabulous https://t.co/3LZrJzg3BJ,"""http://twitter.com/download/iphone"" rel=""nofollow"">Twitter for iPhone</a>",10.0,10.0,Gabe,2015-11-18,This is Gabe. He is a southern Baklava. Gabe has always wanted to fit in with the other bananas. 10/10 fabulous https://t.co/3LZrJzg3BJ,"""http://twitter.com/download/iphone"" rel=""nofollow"">Twitter for iPhone</a>",135.0,346.0,False,False,https://pbs.twimg.com/media/CUIV6F7XIAA1tAM.jpg,1,Pembroke,0.741563,True,Chihuahua,0.0578659,True,toy_poodle,0.0391250999999999,True,doggo,None,1.0,10.0/10.0
667073648344346624,2015-11-18,Here is Dave. He is actually just a skinny legged seal. Happy birthday Dave. 10/10 https://t.co/DPSamreuRq,"""http://twitter.com/download/iphone"" rel=""nofollow"">Twitter for iPhone</a>",10.0,10.0,Dave,2015-11-18,Here is Dave. He is actually just a skinny legged seal. Happy birthday Dave. 10/10 https://t.co/DPSamreuRq,"""http://twitter.com/download/iphone"" rel=""nofollow"">Twitter for iPhone</a>",134.0,425.0,False,False,https://pbs.twimg.com/media/CUHr8WbWEAEBPgf.jpg,1,Chihuahua,0.4836819999999999,True,pug,0.0924938999999999,True,Brabancon_griffon,0.0574954,True,doggo,None,1.0,10.0/10.0
