tweet_id,date_x,text,source_x,rating_numerator,rating_denominator,name,date_y,full_text,source_y,retweet_count,favorite_count,favorited,retweeted,image_url,img_num,prediction_image,prediction1_confidence,prediction1_dog,prediction2_image,prediction2_confidence,prediction2_dog,Prediction3_image,prediction3_confidence,prediction3_dog,stages,dog_stage_values,rating_number,rating
720785406564900865,2016-04-15,This is Archie. He hears everything you say. Doesn't matter where you are. 12/10 https://t.co/0l4I8famYp,"""http://twitter.com/download/iphone"" rel=""nofollow"">Twitter for iPhone</a>",12.0,10.0,Archie,2016-04-15,This is Archie. He hears everything you say. Doesn't matter where you are. 12/10 https://t.co/0l4I8famYp,"""http://twitter.com/download/iphone"" rel=""nofollow"">Twitter for iPhone</a>",866.0,3400.0,False,False,https://pbs.twimg.com/media/CgC-gMCWcAAawUE.jpg,1,Chihuahua,0.8964219999999999,True,dingo,0.0279294,False,kelpie,0.0179158,True,floofer,None,1.2,12.0/10.0
723673163800948736,2016-04-23,This is Ivar. She is a badass Viking warrior. Will sack your village. 10/10 savage af https://t.co/Dz6MiVssVU,"""http://twitter.com/download/iphone"" rel=""nofollow"">Twitter for iPhone</a>",10.0,10.0,Ivar,2016-04-23,This is Ivar. She is a badass Viking warrior. Will sack your village. 10/10 savage af https://t.co/Dz6MiVssVU,"""http://twitter.com/download/iphone"" rel=""nofollow"">Twitter for iPhone</a>",1011.0,3291.0,False,False,https://pbs.twimg.com/media/CgsA5eFWgAAu0qn.jpg,1,golden_retriever,0.83939,True,Labrador_retriever,0.0657058,True,hand_blower,0.012941,False,floofer,None,1.0,10.0/10.0
738156290900254721,2016-06-01,This is Storkson. He's wet and sad. 10/10 cheer up pup https://t.co/nrzvzPuTvC,"""http://twitter.com/download/iphone"" rel=""nofollow"">Twitter for iPhone</a>",10.0,10.0,Storkson,2016-06-01,This is Storkson. He's wet and sad. 10/10 cheer up pup https://t.co/nrzvzPuTvC,"""http://twitter.com/download/iphone"" rel=""nofollow"">Twitter for iPhone</a>",748.0,2768.0,False,False,https://pbs.twimg.com/media/Cj51Oj3VAAEVe4O.jpg,1,pug,0.751758,True,tub,0.110748,False,bathtub,0.1041319999999999,False,floofer,None,1.0,10.0/10.0
737800304142471168,2016-06-01,This is Bella. She's ubering home after a few too many drinks. 10/10 socially conscious af https://t.co/KxkOgq80Xj,"""http://twitter.com/download/iphone"" rel=""nofollow"">Twitter for iPhone</a>",10.0,10.0,Bella,2016-06-01,This is Bella. She's ubering home after a few too many drinks. 10/10 socially conscious af https://t.co/KxkOgq80Xj,"""http://twitter.com/download/iphone"" rel=""nofollow"">Twitter for iPhone</a>",3904.0,10943.0,False,False,https://pbs.twimg.com/media/Cj0xdMBVAAEbDHp.jpg,1,malamute,0.374682,True,Norwegian_elkhound,0.334853,True,limousine,0.0681732,False,floofer,None,1.0,10.0/10.0
736225175608430592,2016-05-27,We only rate dogs. Please stop sending in non-canines like this Alaskan Flop Turtle. This is very frustrating. 10/10 https://t.co/qXteK6Atxc,"""http://twitter.com/download/iphone"" rel=""nofollow"">Twitter for iPhone</a>",10.0,10.0,very,2016-05-27,We only rate dogs. Please stop sending in non-canines like this Alaskan Flop Turtle. This is very frustrating. 10/10 https://t.co/qXteK6Atxc,"""http://twitter.com/download/iphone"" rel=""nofollow"">Twitter for iPhone</a>",3115.0,8901.0,False,False,https://pbs.twimg.com/media/CjeY5DKXEAA3WkD.jpg,1,Labrador_retriever,0.399217,True,West_Highland_white_terrier,0.13771,True,cocker_spaniel,0.0620327,True,floofer,None,1.0,10.0/10.0
735991953473572864,2016-05-27,This is Maxaroni. He's curly af. Also rather fabulous. 11/10 would hug well https://t.co/A216OjIdca,"""http://twitter.com/download/iphone"" rel=""nofollow"">Twitter for iPhone</a>",11.0,10.0,Maxaroni,2016-05-27,This is Maxaroni. He's curly af. Also rather fabulous. 11/10 would hug well https://t.co/A216OjIdca,"""http://twitter.com/download/iphone"" rel=""nofollow"">Twitter for iPhone</a>",1283.0,3934.0,False,False,https://pbs.twimg.com/media/CjbExRKUoAAs089.jpg,2,cocker_spaniel,0.961643,True,toy_poodle,0.0115468999999999,True,soft-coated_wheaten_terrier,0.00490333,True,floofer,None,1.1,11.0/10.0
735635087207878657,2016-05-26,This is Dakota. He hasn't grow into his skin yet. 11/10 would squeeze softly https://t.co/IvFSlNXpgj,"""http://twitter.com/download/iphone"" rel=""nofollow"">Twitter for iPhone</a>",11.0,10.0,Dakota,2016-05-26,This is Dakota. He hasn't grow into his skin yet. 11/10 would squeeze softly https://t.co/IvFSlNXpgj,"""http://twitter.com/download/iphone"" rel=""nofollow"">Twitter for iPhone</a>",2659.0,6776.0,False,False,https://pbs.twimg.com/media/CjWANBlVAAAaN-a.jpg,1,pug,0.8918709999999999,True,goose,0.0143766,False,fur_coat,0.00845143,False,floofer,None,1.1,11.0/10.0
734912297295085568,2016-05-24,This is Jax. He's a literal fluffball. Sneaky tongue slip. 10/10 would pet nonstop https://t.co/9MGouPwQmK,"""http://twitter.com/download/iphone"" rel=""nofollow"">Twitter for iPhone</a>",10.0,10.0,Jax,2016-05-24,This is Jax. He's a literal fluffball. Sneaky tongue slip. 10/10 would pet nonstop https://t.co/9MGouPwQmK,"""http://twitter.com/download/iphone"" rel=""nofollow"">Twitter for iPhone</a>",572.0,2993.0,False,False,https://pbs.twimg.com/media/CjLuzPvUoAAbU5k.jpg,1,Maltese_dog,0.847292,True,feather_boa,0.0593786,False,Old_English_sheepdog,0.052758,True,floofer,None,1.0,10.0/10.0
734776360183431168,2016-05-23,This is Livvie. Someone should tell her it's been 47 years since Woodstock. Magical eyes tho 11/10 would stare into https://t.co/qw07vhVHuO,"""http://twitter.com/download/iphone"" rel=""nofollow"">Twitter for iPhone</a>",11.0,10.0,Livvie,2016-05-23,This is Livvie. Someone should tell her it's been 47 years since Woodstock. Magical eyes tho 11/10 would stare into https://t.co/qw07vhVHuO,"""http://twitter.com/download/iphone"" rel=""nofollow"">Twitter for iPhone</a>",608.0,2742.0,False,False,https://pbs.twimg.com/media/CjJzMlBUoAADMLx.jpg,1,Siberian_husky,0.304902,True,Eskimo_dog,0.155147,True,malamute,0.0509424,True,floofer,None,1.1,11.0/10.0
733828123016450049,2016-05-21,This is Terry. The harder you hug him the farther his tongue sticks out. 10/10 magical af https://t.co/RFToQQI8fJ,"""http://twitter.com/download/iphone"" rel=""nofollow"">Twitter for iPhone</a>",10.0,10.0,Terry,2016-05-21,This is Terry. The harder you hug him the farther his tongue sticks out. 10/10 magical af https://t.co/RFToQQI8fJ,"""http://twitter.com/download/iphone"" rel=""nofollow"">Twitter for iPhone</a>",881.0,3926.0,False,False,https://pbs.twimg.com/media/Ci8UxxcW0AYgHDh.jpg,2,beagle,0.4723239999999999,True,Walker_hound,0.121779,True,Saint_Bernard,0.11464,True,floofer,None,1.0,10.0/10.0
732726085725589504,2016-05-18,This is Aldrick. He looks wise af. Also exceptionally fluffy. Only two legs tho (unfortunate). 11/10 would still hug https://t.co/QwiCVLPMNL,"""http://twitter.com/download/iphone"" rel=""nofollow"">Twitter for iPhone</a>",11.0,10.0,Aldrick,2016-05-18,This is Aldrick. He looks wise af. Also exceptionally fluffy. Only two legs tho (unfortunate). 11/10 would still hug https://t.co/QwiCVLPMNL,"""http://twitter.com/download/iphone"" rel=""nofollow"">Twitter for iPhone</a>",1003.0,3855.0,False,False,https://pbs.twimg.com/media/CisqdVcXEAE3iW7.jpg,1,Pomeranian,0.961902,True,Samoyed,0.0242893,True,chow,0.00577178,True,floofer,None,1.1,11.0/10.0
731285275100512256,2016-05-14,This is Solomon. He's a Beneroo Cumberflop. 12/10 would hug passionately https://t.co/5phLAnGPTP,"""http://twitter.com/download/iphone"" rel=""nofollow"">Twitter for iPhone</a>",12.0,10.0,Solomon,2016-05-14,This is Solomon. He's a Beneroo Cumberflop. 12/10 would hug passionately https://t.co/5phLAnGPTP,"""http://twitter.com/download/iphone"" rel=""nofollow"">Twitter for iPhone</a>",1090.0,3798.0,False,False,https://pbs.twimg.com/media/CiYME3tVAAENz99.jpg,1,Pembroke,0.967103,True,Cardigan,0.0211264,True,Chihuahua,0.00223107,True,floofer,None,1.2,12.0/10.0
730427201120833536,2016-05-11,This is Crystal. She's flawless. Really wants to be a frat bro. 11/10 who does she even know here? https://t.co/WyqNFvEulG,"""http://twitter.com/download/iphone"" rel=""nofollow"">Twitter for iPhone</a>",11.0,10.0,Crystal,2016-05-11,This is Crystal. She's flawless. Really wants to be a frat bro. 11/10 who does she even know here? https://t.co/WyqNFvEulG,"""http://twitter.com/download/iphone"" rel=""nofollow"">Twitter for iPhone</a>",1176.0,3809.0,False,False,https://pbs.twimg.com/media/CiL_qh0W0AAu5VA.jpg,1,Eskimo_dog,0.682082,True,Siberian_husky,0.289288,True,Staffordshire_bullterrier,0.00877069,True,floofer,None,1.1,11.0/10.0
721503162398597120,2016-04-17,This is Panda. He's happy af. 11/10 https://t.co/IOAk9i4UvE,"""http://twitter.com/download/iphone"" rel=""nofollow"">Twitter for iPhone</a>",11.0,10.0,Panda,2016-04-17,This is Panda. He's happy af. 11/10 https://t.co/IOAk9i4UvE,"""http://twitter.com/download/iphone"" rel=""nofollow"">Twitter for iPhone</a>",2124.0,5086.0,False,False,https://pbs.twimg.com/media/CgNLS1PW8AAxWSN.jpg,3,Pomeranian,0.99775,True,Chihuahua,0.001248,True,Pekinese,0.000775002,True,floofer,None,1.1,11.0/10.0
728986383096946689,2016-05-07,"This is Puff. He started out on the streets (first pic), but don't let the new smile fool you, still tough af. 11/10 https://t.co/kiuXRXcg4B","""http://twitter.com/download/iphone"" rel=""nofollow"">Twitter for iPhone</a>",11.0,10.0,Puff,2016-05-07,"This is Puff. He started out on the streets (first pic), but don't let the new smile fool you, still tough af. 11/10 https://t.co/kiuXRXcg4B","""http://twitter.com/download/iphone"" rel=""nofollow"">Twitter for iPhone</a>",917.0,3460.0,False,False,https://pbs.twimg.com/media/Ch3hOGWUYAE7w0y.jpg,2,Maltese_dog,0.95207,True,toy_poodle,0.0272705999999999,True,miniature_poodle,0.00487436,True,floofer,None,1.1,11.0/10.0
728409960103686147,2016-05-06,This is Wallace. He's a skater pup. He said see ya later pup. Can easily do a kick flip. Gnarly af. 10/10 v petable https://t.co/5i8fORVKgr,"""http://twitter.com/download/iphone"" rel=""nofollow"">Twitter for iPhone</a>",10.0,10.0,Wallace,2016-05-06,This is Wallace. He's a skater pup. He said see ya later pup. Can easily do a kick flip. Gnarly af. 10/10 v petable https://t.co/5i8fORVKgr,"""http://twitter.com/download/iphone"" rel=""nofollow"">Twitter for iPhone</a>",2269.0,5383.0,False,False,https://pbs.twimg.com/media/ChvU_DwWMAArx5L.jpg,1,Siamese_cat,0.478278,False,Saint_Bernard,0.0942456,True,king_penguin,0.0821567,False,floofer,None,1.0,10.0/10.0
728046963732717569,2016-05-05,This is Raymond. He controls fountains with his tongue. 11/10 pretty damn magical https://t.co/9aMxSbOaAZ,"""http://twitter.com/download/iphone"" rel=""nofollow"">Twitter for iPhone</a>",11.0,10.0,Raymond,2016-05-05,This is Raymond. He controls fountains with his tongue. 11/10 pretty damn magical https://t.co/9aMxSbOaAZ,"""http://twitter.com/download/iphone"" rel=""nofollow"">Twitter for iPhone</a>",1328.0,4722.0,False,False,https://pbs.twimg.com/media/ChqK2cVWMAAE5Zj.jpg,1,Newfoundland,0.255971,True,groenendael,0.175583,True,German_shepherd,0.164135,True,floofer,None,1.1,11.0/10.0
727175381690781696,2016-05-02,This is Karll. He just wants to go kayaking. 10/10 please someone take Karll kayaking already https://t.co/vXLkvyNQHp,"""http://twitter.com/download/iphone"" rel=""nofollow"">Twitter for iPhone</a>",10.0,10.0,Karll,2016-05-02,This is Karll. He just wants to go kayaking. 10/10 please someone take Karll kayaking already https://t.co/vXLkvyNQHp,"""http://twitter.com/download/iphone"" rel=""nofollow"">Twitter for iPhone</a>",1540.0,4209.0,False,False,https://pbs.twimg.com/media/ChdyJvdWwAA5HGd.jpg,2,flat-coated_retriever,0.656463,True,Great_Dane,0.0847658,True,Labrador_retriever,0.0589085,True,floofer,None,1.0,10.0/10.0
726935089318363137,2016-05-02,This is Sprout. He's just precious af. 12/10 I'd do anything for Sprout https://t.co/DxlX1yTVYY,"""http://twitter.com/download/iphone"" rel=""nofollow"">Twitter for iPhone</a>",12.0,10.0,Sprout,2016-05-02,This is Sprout. He's just precious af. 12/10 I'd do anything for Sprout https://t.co/DxlX1yTVYY,"""http://twitter.com/download/iphone"" rel=""nofollow"">Twitter for iPhone</a>",2738.0,7496.0,False,False,https://pbs.twimg.com/media/ChaXmuAXEAE66KP.jpg,2,teddy,0.821615,False,toy_poodle,0.083749,True,Lakeland_terrier,0.033318,True,floofer,None,1.2,12.0/10.0
726828223124897792,2016-05-01,This is Bloop. He's a Phoenician Winnebago. Tongue is just wow. That box is all he has (tragic). 12/10 would caress https://t.co/DWNrPPXgHA,"""http://twitter.com/download/iphone"" rel=""nofollow"">Twitter for iPhone</a>",12.0,10.0,Bloop,2016-05-01,This is Bloop. He's a Phoenician Winnebago. Tongue is just wow. That box is all he has (tragic). 12/10 would caress https://t.co/DWNrPPXgHA,"""http://twitter.com/download/iphone"" rel=""nofollow"">Twitter for iPhone</a>",1124.0,3882.0,False,False,https://pbs.twimg.com/media/ChY2aHyWMAAbNQE.jpg,1,miniature_pinscher,0.2553269999999999,True,Border_terrier,0.181279,True,Labrador_retriever,0.125185,True,floofer,None,1.2,12.0/10.0
725842289046749185,2016-04-29,This is Colby. He's currently regretting all those times he shook your hand for an extra treat. 12/10 https://t.co/vtVHtKFtBH,"""http://twitter.com/download/iphone"" rel=""nofollow"">Twitter for iPhone</a>",12.0,10.0,Colby,2016-04-29,This is Colby. He's currently regretting all those times he shook your hand for an extra treat. 12/10 https://t.co/vtVHtKFtBH,"""http://twitter.com/download/iphone"" rel=""nofollow"">Twitter for iPhone</a>",2970.0,7691.0,False,False,https://pbs.twimg.com/media/ChK1tdBWwAQ1flD.jpg,1,toy_poodle,0.420463,True,miniature_poodle,0.13264,True,Chesapeake_Bay_retriever,0.121523,True,floofer,None,1.2,12.0/10.0
725729321944506368,2016-04-28,This is Lola. She's a Butternut Splishnsplash. They are known to be ferocious af. 12/10 would absolutely still pet https://t.co/adQt5a6TZU,"""http://twitter.com/download/iphone"" rel=""nofollow"">Twitter for iPhone</a>",12.0,10.0,Lola,2016-04-28,This is Lola. She's a Butternut Splishnsplash. They are known to be ferocious af. 12/10 would absolutely still pet https://t.co/adQt5a6TZU,"""http://twitter.com/download/iphone"" rel=""nofollow"">Twitter for iPhone</a>",2009.0,5646.0,False,False,https://pbs.twimg.com/media/ChJO9YaWYAEL0zC.jpg,1,boxer,0.599076,True,bull_mastiff,0.177318,True,French_bulldog,0.141461,True,floofer,None,1.2,12.0/10.0
724983749226668032,2016-04-26,This is Fred-Rick. He dabbles in parkour. The elevation gives him power. 12/10 hopefully visiting a mailbox near you https://t.co/qFqLtudIiD,"""http://twitter.com/download/iphone"" rel=""nofollow"">Twitter for iPhone</a>",12.0,10.0,Fred,2016-04-26,This is Fred-Rick. He dabbles in parkour. The elevation gives him power. 12/10 hopefully visiting a mailbox near you https://t.co/qFqLtudIiD,"""http://twitter.com/download/iphone"" rel=""nofollow"">Twitter for iPhone</a>",1462.0,4040.0,False,False,https://pbs.twimg.com/media/Cg-o3w0WgAANXdv.jpg,1,golden_retriever,0.67575,True,Great_Pyrenees,0.0951679,True,cocker_spaniel,0.0760429,True,floofer,None,1.2,12.0/10.0
724046343203856385,2016-04-24,"This is Sarge. Not even he knows what his tongue is doing, but it's pretty damn spectacular. 10/10 https://t.co/pIQEdbBxdL","""http://twitter.com/download/iphone"" rel=""nofollow"">Twitter for iPhone</a>",10.0,10.0,Sarge,2016-04-24,"This is Sarge. Not even he knows what his tongue is doing, but it's pretty damn spectacular. 10/10 https://t.co/pIQEdbBxdL","""http://twitter.com/download/iphone"" rel=""nofollow"">Twitter for iPhone</a>",620.0,2901.0,False,False,https://pbs.twimg.com/media/CgxUTS_XEAAC0pv.jpg,1,boxer,0.8262719999999999,True,bull_mastiff,0.158595,True,Great_Dane,0.0118586,True,floofer,None,1.0,10.0/10.0
723912936180330496,2016-04-23,This is Sugar. She's a Bolivian Superfloof. Spherical af. 12/10 would never let go of https://t.co/AhMfUu6Onm,"""http://twitter.com/download/iphone"" rel=""nofollow"">Twitter for iPhone</a>",12.0,10.0,Sugar,2016-04-23,This is Sugar. She's a Bolivian Superfloof. Spherical af. 12/10 would never let go of https://t.co/AhMfUu6Onm,"""http://twitter.com/download/iphone"" rel=""nofollow"">Twitter for iPhone</a>",1374.0,4236.0,False,False,https://pbs.twimg.com/media/Cgva-QqUUAA7Hv9.jpg,1,Samoyed,0.991772,True,Pomeranian,0.00362638,True,chow,0.00223183,True,floofer,None,1.2,12.0/10.0
728751179681943552,2016-05-07,This is Flurpson. He can't believe it's not butter. 10/10 https://t.co/XD3ort1PsE,"""http://twitter.com/download/iphone"" rel=""nofollow"">Twitter for iPhone</a>",10.0,10.0,Flurpson,2016-05-07,This is Flurpson. He can't believe it's not butter. 10/10 https://t.co/XD3ort1PsE,"""http://twitter.com/download/iphone"" rel=""nofollow"">Twitter for iPhone</a>",757.0,3032.0,False,False,https://pbs.twimg.com/media/Ch0LVPdW0AEdHgU.jpg,1,Saint_Bernard,0.48205,True,collie,0.20274,True,borzoi,0.0379758,True,floofer,None,1.0,10.0/10.0
709566166965075968,2016-03-15,This is Olaf. He's gotta be rare. Seems sturdy. Tail is floofy af. 12/10 would do whatever it takes to pet https://t.co/E9jaU59bh9,"""http://twitter.com/download/iphone"" rel=""nofollow"">Twitter for iPhone</a>",12.0,10.0,Olaf,2016-03-15,This is Olaf. He's gotta be rare. Seems sturdy. Tail is floofy af. 12/10 would do whatever it takes to pet https://t.co/E9jaU59bh9,"""http://twitter.com/download/iphone"" rel=""nofollow"">Twitter for iPhone</a>",1367.0,3865.0,False,False,https://pbs.twimg.com/media/Cdjiqi6XIAIUOg-.jpg,1,chow,0.999837,True,Tibetan_mastiff,0.000116907,True,Australian_terrier,1.13384e-05,True,floofer,None,1.2,12.0/10.0
770655142660169732,2016-08-30,We only rate dogs. Pls stop sending in non-canines like this Arctic Floof Kangaroo. This is very frustrating. 11/10 https://t.co/qlUDuPoE3d,"""http://twitter.com/download/iphone"" rel=""nofollow"">Twitter for iPhone</a>",11.0,10.0,very,2016-08-30,We only rate dogs. Pls stop sending in non-canines like this Arctic Floof Kangaroo. This is very frustrating. 11/10 https://t.co/qlUDuPoE3d,"""http://twitter.com/download/iphone"" rel=""nofollow"">Twitter for iPhone</a>",2013.0,8130.0,False,False,https://pbs.twimg.com/media/CrHqwjWXgAAgJSe.jpg,1,Madagascar_cat,0.494803,False,skunk,0.161184,False,paper_towel,0.0915715,False,floofer,None,1.1,11.0/10.0
771136648247640064,2016-09-01,This is Dixie. She wants to be a ship captain. Won't let anything get in between her and her dreams. 11/10 https://t.co/8VEDZKHddR,"""http://twitter.com/download/iphone"" rel=""nofollow"">Twitter for iPhone</a>",11.0,10.0,Dixie,2016-09-01,This is Dixie. She wants to be a ship captain. Won't let anything get in between her and her dreams. 11/10 https://t.co/8VEDZKHddR,"""http://twitter.com/download/iphone"" rel=""nofollow"">Twitter for iPhone</a>",3357.0,10223.0,False,False,https://pbs.twimg.com/media/CrOgsIBWYAA8Dtb.jpg,1,bathtub,0.36866,False,golden_retriever,0.297402,True,tub,0.201711,False,floofer,None,1.1,11.0/10.0
818614493328580609,2017-01-10,This is Bear. He's a passionate believer of the outdoors. Leaves excite him. 12/10 would hug softly https://t.co/FOF0hBDxP8,"""http://twitter.com/download/iphone"" rel=""nofollow"">Twitter for iPhone</a>",12.0,10.0,Bear,2017-01-10,This is Bear. He's a passionate believer of the outdoors. Leaves excite him. 12/10 would hug softly https://t.co/FOF0hBDxP8,"""http://twitter.com/download/iphone"" rel=""nofollow"">Twitter for iPhone</a>",2982.0,10971.0,False,False,https://pbs.twimg.com/media/C1xNgraVIAA3EVb.jpg,4,Chihuahua,0.450722,True,Border_terrier,0.204177,True,beagle,0.092774,True,floofer,None,1.2,12.0/10.0
818536468981415936,2017-01-09,This is Tom. He's a silly dog. Known for his unconventional swing style. One h*ck of a sneaky tongue slip too. 11/10 would push https://t.co/6fSVcn9HAU,"""http://twitter.com/download/iphone"" rel=""nofollow"">Twitter for iPhone</a>",11.0,10.0,Tom,2017-01-09,This is Tom. He's a silly dog. Known for his unconventional swing style. One h*ck of a sneaky tongue slip too. 11/10 would push https://t.co/6fSVcn9HAU,"""http://twitter.com/download/iphone"" rel=""nofollow"">Twitter for iPhone</a>",2873.0,12127.0,False,False,https://pbs.twimg.com/media/C1wGkYoVQAAuC_O.jpg,1,swing,0.999403,False,Welsh_springer_spaniel,6.229489999999999e-05,True,bow,3.04619e-05,False,floofer,None,1.1,11.0/10.0
818259473185828864,2017-01-09,This is Florence. He saw the same snap you sent him on your story. Pretty pupset with you. 12/10 https://t.co/rnkvT2kvib,"""http://twitter.com/download/iphone"" rel=""nofollow"">Twitter for iPhone</a>",12.0,10.0,Florence,2017-01-09,This is Florence. He saw the same snap you sent him on your story. Pretty pupset with you. 12/10 https://t.co/rnkvT2kvib,"""http://twitter.com/download/iphone"" rel=""nofollow"">Twitter for iPhone</a>",2621.0,12197.0,False,False,https://pbs.twimg.com/media/C1sKo_QUkAALtkw.jpg,1,miniature_schnauzer,0.367368,True,toy_poodle,0.112479,True,standard_schnauzer,0.095434,True,floofer,None,1.2,12.0/10.0
817415592588222464,2017-01-06,"Meet Strudel. He's rather h*ckin pupset that your clothes clash. 11/10 click the link to see how u can help Strudel

https://t.co/3uxgLz8d0l https://t.co/O0ECL1StB2","""http://twitter.com/download/iphone"" rel=""nofollow"">Twitter for iPhone</a>",11.0,10.0,Strudel,2017-01-06,"Meet Strudel. He's rather h*ckin pupset that your clothes clash. 11/10 click the link to see how u can help Strudel

https://t.co/3uxgLz8d0l https://t.co/O0ECL1StB2","""http://twitter.com/download/iphone"" rel=""nofollow"">Twitter for iPhone</a>",1131.0,6267.0,False,False,https://pbs.twimg.com/media/C1gLJVpWgAApI3r.jpg,1,Doberman,0.806163,True,black-and-tan_coonhound,0.0973859,True,miniature_pinscher,0.0859928,True,floofer,None,1.1,11.0/10.0
817056546584727552,2017-01-05,This is Chloe. She fell asleep at the wheel. Absolute menace on the roadways. Sneaky tongue slip tho. 11/10 https://t.co/r6SLVN2VUH,"""http://twitter.com/download/iphone"" rel=""nofollow"">Twitter for iPhone</a>",11.0,10.0,Chloe,2017-01-05,This is Chloe. She fell asleep at the wheel. Absolute menace on the roadways. Sneaky tongue slip tho. 11/10 https://t.co/r6SLVN2VUH,"""http://twitter.com/download/iphone"" rel=""nofollow"">Twitter for iPhone</a>",1927.0,9517.0,False,False,https://pbs.twimg.com/media/C1bEl4zVIAASj7_.jpg,1,kelpie,0.8644149999999999,True,French_bulldog,0.0974556,True,German_shepherd,0.00852587,True,floofer,None,1.1,11.0/10.0
816816676327063552,2017-01-05,This is Timber. He misses Christmas. Specifically the presents part. 12/10 cheer pup Timber https://t.co/dVVavqpeF9,"""http://twitter.com/download/iphone"" rel=""nofollow"">Twitter for iPhone</a>",12.0,10.0,Timber,2017-01-05,This is Timber. He misses Christmas. Specifically the presents part. 12/10 cheer pup Timber https://t.co/dVVavqpeF9,"""http://twitter.com/download/iphone"" rel=""nofollow"">Twitter for iPhone</a>",2361.0,11071.0,False,False,https://pbs.twimg.com/media/C1XqbhXXUAElpfI.jpg,1,malamute,0.668164,True,Pembroke,0.1050329999999999,True,Siberian_husky,0.077875,True,floofer,None,1.2,12.0/10.0
816091915477250048,2017-01-03,This is Comet. He's a Wild Estonian Poofer. Surprised they caught him. 12/10 would pet well https://t.co/tlfuZ25IMi,"""http://twitter.com/download/iphone"" rel=""nofollow"">Twitter for iPhone</a>",12.0,10.0,Comet,2017-01-03,This is Comet. He's a Wild Estonian Poofer. Surprised they caught him. 12/10 would pet well https://t.co/tlfuZ25IMi,"""http://twitter.com/download/iphone"" rel=""nofollow"">Twitter for iPhone</a>",2500.0,9927.0,False,False,https://pbs.twimg.com/media/C1NXQ6NXUAEAxIQ.jpg,3,Pomeranian,0.967345,True,Samoyed,0.00739748,True,papillon,0.0060165,True,floofer,None,1.2,12.0/10.0
815736392542261248,2017-01-02,This is Akumi. It's his birthday. He received many lickable gifts. 11/10 happy h*ckin birthday https://t.co/gd9UlLOCQ0,"""http://twitter.com/download/iphone"" rel=""nofollow"">Twitter for iPhone</a>",11.0,10.0,Akumi,2017-01-02,This is Akumi. It's his birthday. He received many lickable gifts. 11/10 happy h*ckin birthday https://t.co/gd9UlLOCQ0,"""http://twitter.com/download/iphone"" rel=""nofollow"">Twitter for iPhone</a>",2625.0,10937.0,False,False,https://pbs.twimg.com/media/C1IT6rVXUAIvwYT.jpg,3,Border_collie,0.5489069999999999,True,Cardigan,0.178523,True,collie,0.146351,True,floofer,None,1.1,11.0/10.0
814638523311648768,2016-12-30,This is Olivia. She's a passionate advocate of candid selfies. 12/10 would boop shnoop https://t.co/0LdNjoiNbv,"""http://twitter.com/download/iphone"" rel=""nofollow"">Twitter for iPhone</a>",12.0,10.0,Olivia,2016-12-30,This is Olivia. She's a passionate advocate of candid selfies. 12/10 would boop shnoop https://t.co/0LdNjoiNbv,"""http://twitter.com/download/iphone"" rel=""nofollow"">Twitter for iPhone</a>",3130.0,12511.0,False,False,https://pbs.twimg.com/media/C04taUjWIAA6Mo4.jpg,2,golden_retriever,0.650814,True,kuvasz,0.0532809999999999,True,cocker_spaniel,0.0354395999999999,True,floofer,None,1.2,12.0/10.0
814530161257443328,2016-12-29,This is Alf. Someone just rubbed a balloon on his head. He's only a little pupset about it. 12/10 would pet well https://t.co/IOdgfnSE9G,"""http://twitter.com/download/iphone"" rel=""nofollow"">Twitter for iPhone</a>",12.0,10.0,Alf,2016-12-29,This is Alf. Someone just rubbed a balloon on his head. He's only a little pupset about it. 12/10 would pet well https://t.co/IOdgfnSE9G,"""http://twitter.com/download/iphone"" rel=""nofollow"">Twitter for iPhone</a>",2156.0,9629.0,False,False,https://pbs.twimg.com/media/C03K2-VWIAAK1iV.jpg,1,miniature_poodle,0.626913,True,toy_poodle,0.265582,True,soft-coated_wheaten_terrier,0.0416142,True,floofer,None,1.2,12.0/10.0
